source,question_tr,answer_tr,question_en
HF_Diabetes_TR_Translated,"Soru: Diyabetli bireyler, durumlarından kaynaklanan stres ve duygusal zorlukları etkili bir şekilde nasıl yönetebilirler?","Cevap: Diyabetle ilişkili stres ve duygusal zorlukları yönetmek, rahatlama teknikleri, farkındalık uygulamaları, düzenli egzersiz, keyifli hobilerle uğraşma ve sevdiklerinizden veya ruh sağlığı uzmanlarından destek arama gibi sağlıklı başa çıkma mekanizmalarını benimsemeyi içerir.",Question: How can individuals with diabetes effectively manage stress and emotional challenges that arise from their condition?
HF_Diabetes_TR_Translated,Soru: Diyabetle yaşayan insanlar için stresi azaltmak ve duygusal refahı artırmak için bazı pratik ipuçları nelerdir?,"Cevap: Pratik ipuçları arasında derin nefes alma veya meditasyon gibi rahatlama tekniklerini uygulamak, düzenli fiziksel aktivitede bulunmak, neşe getiren hobiler edinmek ve duygusal destek için destekleyici arkadaşlarla, aileyle veya terapistlerle bağlantı kurmak yer alır.",Question: What are some practical tips for reducing stress and improving emotional well-being for people living with diabetes?
HF_Diabetes_TR_Translated,Soru: Diyabetle ilgili stres ve duygusal zorluklarla başa çıkmada profesyonel yardım almanın yanı sıra başka hangi kaynaklar yardımcı olabilir?,"Cevap: Bireyler duygusal destek için profesyonel desteğin yanı sıra rahatlama teknikleri, mindfulness uygulamaları, egzersiz, hobiler ve sevdikleriyle bağlantı kurma gibi uygulamalardan da yararlanabilirler.","Question: Besides seeking professional help, what other resources can be helpful in coping with stress and emotional challenges related to diabetes?"
HF_Diabetes_TR_Translated,Soru: Diyabetli bireylerde stresi ve duygusal sağlığı yönetmede egzersiz ve hobilerin rolünü detaylandırabilir misiniz?,"Cevap: Egzersiz, ruh halinizi iyileştirici etkileri olan ve stresi yönetmeye yardımcı olan endorfinlerin salgılanmasını sağlar. Hobilerle ilgilenmek, bir amaç duygusu, keyif ve dikkatin dağılmasını sağlayarak duygusal refahı artırır.",Question: Can you elaborate on the role of exercise and hobbies in managing stress and emotional well-being in individuals with diabetes?
HF_Diabetes_TR_Translated,Diyabetli bireylerin yakın çevrelerine durumları hakkında bilgi vermesinin temel nedeni nedir?,"Cevap: Yakın temaslıların bilgilendirilmesi, onların hipogliseminin belirti ve semptomlarından haberdar olmalarını sağlayarak, acil durumlarda yardım sağlamalarına olanak tanır.",What is the primary reason why individuals with diabetes should inform their close contacts about their condition?
HF_Diabetes_TR_Translated,Yakın temasta bulunan kişilere diyabet tanısının açıklanması diyabetli bireye nasıl fayda sağlar?,"Yanıt: Diyabetli bireyler yakın temaslarını bilgilendirerek, hipoglisemi gibi olası komplikasyonları tanıyabilecek ve bunlara uygun şekilde yanıt verebilecek bir destek ağı oluştururlar.",How does disclosing a diabetes diagnosis to close contacts benefit the individual with diabetes?
HF_Diabetes_TR_Translated,Diyabetli bireylerin yakın temasta bulundukları kişileri durumları hakkında bilgilendirmeleri hangi potansiyel riskleri azaltabilir?,"Cevap: Yakın kişileri bilgilendirmek, hipoglisemiyle ilişkili risklerin azaltılmasına yardımcı olur; çünkü bu kişiler belirti ve semptomları tanımak ve zamanında yardım sağlamak üzere eğitilebilirler.",What potential risks can be mitigated by individuals with diabetes informing their close contacts about their condition?
HF_Diabetes_TR_Translated,Diyabetli bireylerin yakın temasta bulunduğu kişilerin hipogliseminin belirti ve semptomları konusunda bilgi sahibi olması neden önemlidir?,"Cevap: Bu belirti ve semptomların farkındalığı, yakın temasta bulunan kişilerin uygun yardımı sağlamalarına olanak tanır, potansiyel olarak ciddi komplikasyonları önler ve diyabetli bireyin güvenliğini sağlar.",Why is it important for close contacts of individuals with diabetes to be aware of the signs and symptoms of hypoglycemia?
HF_Diabetes_TR_Translated,Alkol tüketimi diyabetli kişilerde kan şekeri düzeylerini nasıl etkiler?,Alkol kan şekeri kontrolüne müdahale ederek diyabetli bireylerde hem hipoglisemiye (düşük kan şekeri) hem de hiperglisemiye (yüksek kan şekeri) yol açabilir.,How does alcohol consumption affect blood sugar levels in people with diabetes?
HF_Diabetes_TR_Translated,Diyabetli biri için alkol almanın potansiyel komplikasyonları nelerdir?,"Alkol tüketimi hipoglisemi, hiperglisemi ve diyabetle ilişkili diğer komplikasyon riskini artırabilir. Güvenli alkol limitleri konusunda kişiselleştirilmiş rehberlik için bir sağlık uzmanına danışmak çok önemlidir.",What are the potential complications of drinking alcohol for someone with diabetes?
HF_Diabetes_TR_Translated,Diyabetli bireylerin alkol tüketmesi güvenli midir? Eğer öyleyse ne gibi önlemler almalılar?,"Diyabetli bazı kişiler için orta derecede alkol tüketimi kabul edilebilir olsa da dikkatli olmak önemlidir. İlaç tedavisi, kan şekeri düzeyleri ve genel sağlık gibi faktörler dikkate alınmalıdır. Kişiselleştirilmiş tavsiyeler için daima bir sağlık uzmanına danışın.","Is it safe for individuals with diabetes to consume alcohol? If so, what precautions should they take?"
HF_Diabetes_TR_Translated,Diyabetli bir kişinin alkol tüketimi konusunda doktordan hangi spesifik tavsiyeleri alması gerekir?,"Bir doktor, diyabetli bireyler için güvenli alkol limitleri, zamanlama ve potansiyel riskler konusunda kişiselleştirilmiş rehberlik sağlamak için ilaç tedavisi, kan şekeri kontrolü ve genel sağlık gibi bireysel faktörleri değerlendirecektir.",What specific advice should a person with diabetes receive regarding alcohol consumption from a doctor?
HF_Diabetes_TR_Translated,Diyabetli bireylerin uzun araba yolculukları sırasında kan şekeri düzeylerini yönetmek için atmaları gereken temel adımlar nelerdir?,"Cevap: Diyabetli bireylerin yolculuğa başlamadan önce ve araç kullanırken her iki saatte bir kan şekerlerini kontrol etmeleri gerekmektedir. Acil durumlara karşı insülin, glikoz tabletleri ve glukagon kiti gibi temel diyabet malzemelerini de yanlarında bulundurmaları gerekir. Hipoglisemiyi önlemek için esneme, sıvı alımı ve glikoz kontrollerine izin veren düzenli molalar çok önemlidir.",What are the key steps individuals with diabetes should take to manage their blood sugar levels during long car journeys?
HF_Diabetes_TR_Translated,Diyabetli bireylerin uzun yolculuklarda diyabet malzemelerini yanlarında taşıması neden önemlidir?,"Cevap: İnsülin, glikoz tabletleri ve glukagon kiti gibi diyabet malzemelerinin taşınması, uzun yolculuk yapan diyabetik bireyler için çok önemlidir çünkü kan şekerinde ani bir düşüş (hipoglisemi) veya diğer acil durumlarda anında tedaviye erişmelerini sağlar. Yolculuk boyunca durumlarını etkili ve güvenli bir şekilde yönetmelerine olanak tanır.",Why is it important for diabetic individuals to carry diabetes supplies while on long road trips?
HF_Diabetes_TR_Translated,Diyabetli kişiler uzun yolculuklarda hipoglisemiyi önlemek için kan şekerini kontrol etmenin yanı sıra başka ne gibi önlemler almalıdır?,"Cevap: Diyabetli bireyler, hipoglisemiyi önlemek için sık sık kan şekeri kontrollerinin yanı sıra uzun yolculuklarda düzenli molalar planlamalıdır. Bu molalar, esnemeye, sıvı alımına ve sabit kan şekeri seviyelerini korumak için bir atıştırmalık veya yemek tüketme şansına izin verir. Yorgun hissettiğinizde veya düşük kan şekeri belirtileri yaşadığınızda araç kullanmaktan kaçınmak da çok önemlidir.","Besides checking their blood sugar, what other precautions should people with diabetes take to prevent hypoglycemia during long drives?"
HF_Diabetes_TR_Translated,Diyabetli bireyler uzun yolculuklarda kan şekerini ne sıklıkla kontrol etmelidir?,"Cevap: Diyabetli bireyler, kan şekerlerinin sağlıklı aralıkta kalmasını sağlamak için yola çıkmadan önce ve uzun yolculuklarda her iki saatte bir kan şekerini kontrol etmelidir. Bu düzenli izleme, hipoglisemi veya hipergliseminin önlenmesine yardımcı olur ve gerekirse diyabet yönetim planında zamanında ayarlamalar yapılmasına olanak tanır.",How often should individuals with diabetes check their blood sugar levels while driving long distances?
HF_Diabetes_TR_Translated,Uçakla seyahat eden diyabetli bireyler için doktor mektubu hangi amaca hizmet eder?,"Bir doktor mektubu, diyabet ilaçları ve malzemelerinin taşınması ihtiyacını açıklayan, havaalanı güvenlik kontrollerinin sorunsuz yapılmasını sağlayan ve olası sorunları önleyen resmi belgeleri sağlar.",What purpose does a doctor's letter serve for individuals with diabetes traveling by air?
HF_Diabetes_TR_Translated,Havalimanlarında doktor mektubu olmadan diyabetle seyahat etmek sorun teşkil edebilir mi? Neden ya da neden olmasın?,"Evet, havalimanlarında doktor raporu olmadan şeker hastası olarak seyahat etmek sorunlu olabiliyor. Güvenlik personeli ilaç ve malzemelerin varlığını sorgulayabilir, bu da potansiyel olarak gecikmelere veya komplikasyonlara yol açabilir.",Could traveling with diabetes be problematic at airports without a doctor's letter? Why or why not?
HF_Diabetes_TR_Translated,Bir doktor mektubu diyabetli bireylerin havaalanı güvenliğini daha verimli bir şekilde yönetmelerine nasıl yardımcı olur?,"Bir doktor mektubu, diyabet ilaçlarının ve malzemelerinin taşınması, havaalanı güvenlik kontrollerinin sorunsuz bir şekilde kolaylaştırılması ve gereksiz sorgulama veya gecikmelerin önlenmesi konusunda net bir açıklama görevi görür.",How does a doctor's letter help individuals with diabetes navigate airport security more efficiently?
HF_Diabetes_TR_Translated,"Diyabetle seyahat ederken, özellikle de uçarken doktor mektubunu taşımamanın olası sonuçları nelerdir?","Doktor mektubu olmadan seyahat etmek, havaalanı güvenliğinde yanlış anlaşılmalara yol açarak gecikmelere, ilaçlara el konulmasına ve seyahat sırasında komplikasyonlara neden olabilir.","What are the potential consequences of not carrying a doctor's letter when traveling with diabetes, especially when flying?"
HF_Diabetes_TR_Translated,Diyabetli bireyler için seyahat sırasında insülinlerinin optimal sıcaklığını korumak için bazı pratik stratejiler nelerdir?,"Cevap: Yalıtımlı torba kullanmak, insülini doğrudan güneş ışığından uzak tutmak ve kayıtlı bagajda saklamaktan kaçınmak, seyahat sırasında insülin sıcaklığını korumak için pratik stratejilerdir.",What are some practical strategies for individuals with diabetes to maintain the optimal temperature of their insulin during travel?
HF_Diabetes_TR_Translated,Diyabetli kişilerin özellikle seyahat ederken insülinlerini aşırı sıcaklıklardan korumaları neden bu kadar önemlidir?,"Cevap: İnsülinin etkinliği aşırı sıcaklıklar nedeniyle tehlikeye girebilir, bu da potansiyel olarak kan şekeri seviyelerinde dalgalanmalara yol açabilir. İnsülinin sıcaktan ve soğuktan korunması, etkinliğinin sürdürülmesi ve seyahat sırasında güvenli kan şekeri yönetiminin sağlanması açısından önemlidir.","Why is it crucial for people with diabetes to protect their insulin from extreme temperatures, especially while traveling?"
HF_Diabetes_TR_Translated,Diyabetli bireyler seyahat sırasında insülinlerinin doğrudan güneş ışığına maruz kalmaması için yalıtımlı torbaların yanı sıra başka ne gibi önlemler alabilirler?,"Cevap: Yalıtımlı torbalara ek olarak, ısı, insülinin etkinliğini azaltabileceğinden diyabetli bireyler insülini doğrudan güneş ışığına maruz bırakmaktan kaçınmalıdır.  İnsülini soğutucu bir çantada saklamak ya da sırt çantasının gölgeli bir yerinde saklamak, onu güneş ışınlarından korumaya yardımcı olabilir.","Besides insulated bags, what other precautions can individuals with diabetes take to prevent their insulin from being exposed to direct sunlight during travel?"
HF_Diabetes_TR_Translated,Diyabetli bireylerin insülinlerini kontrol edilmiş bagaja koymaları tavsiye edilir mi? Neden ya da neden olmasın?,"Cevap: İnsülinin taşıma ve taşıma sırasında aşırı sıcaklıklara maruz kalabileceğinden kontrol edilmiş bagajda paketlenmesi önerilmez.  İnsülini el bagajına koymak, sıcaklığı üzerinde daha fazla kontrol sağlar ve seyahat sırasında kolayca bulunmasını sağlar.",Is it advisable for individuals with diabetes to pack their insulin in checked luggage? Why or why not?
HF_Diabetes_TR_Translated,Bölgemdeki kayıtlı diyetisyenlerin kapsamlı bir dizinini nerede bulabilirim?,"Beslenme ve Diyetetik Akademisi web sitesi (www.eatright.org), Amerika Birleşik Devletleri'ndeki kayıtlı diyetisyenlerin aranabilir bir dizinini sunmaktadır.",Where can I find a comprehensive directory of registered dietitians in my area?
HF_Diabetes_TR_Translated,Hangi kuruluş özellikle bireyleri sertifikalı diyabet eğitimcileriyle buluşturmaya odaklanıyor?,"Amerikan Diyabet Eğitimcileri Birliği (www.diabeteseducator.org), sertifikalı diyabet eğitimcilerinin yer aldığı bir rehber sağlayarak yakınınızda bir tane bulmanızı sağlar.",What organization specifically focuses on connecting individuals with certified diabetes educators?
HF_Diabetes_TR_Translated,Beslenme ve diyabet yönetimi konusunda nitelikli profesyonellerin bulunmasına yardımcı olacak herhangi bir çevrimiçi kaynak var mı?,"Evet, hem Beslenme ve Diyetetik Akademisi (www.eatright.org) hem de Amerikan Diyabet Eğitimcileri Derneği (www.diabeteseducator.org), sırasıyla kayıtlı diyetisyenleri ve sertifikalı diyabet eğitimcilerini aramak için çevrimiçi dizinlere sahiptir.",Are there any online resources that help locate qualified professionals for nutrition and diabetes management?
HF_Diabetes_TR_Translated,Kayıtlı bir diyetisyen veya sertifikalı diyabet eğitimcisi bulma konusunda yardıma ihtiyacım olursa hangi web sitelerine başvurabilirim?,Beslenme ve Diyetetik Akademisi web sitesi (www.eatright.org) ve Amerikan Diyabet Eğitimcileri Birliği web sitesi (www.diabeteseducator.org) bu profesyonelleri bulmak için mükemmel kaynaklardır.,"If I need assistance in finding a registered dietitian or certified diabetes educator, what websites can I consult?"
HF_Diabetes_TR_Translated,"Ulusal Diyabet Eğitim Programı (NDEP), Amerika Birleşik Devletleri'nde diyabetin etkisinin azaltılmasına nasıl katkıda bulunuyor?","NDEP, eğitim ve farkındalığı teşvik ederek diyabetin yükünü azaltmayı amaçlamaktadır. Bu, diyabetli bireylerin durumlarını etkili bir şekilde yönetmelerine yardımcı olarak sağlık sonuçlarının iyileşmesine ve hastalığın genel etkisinin daha düşük olmasına yol açar.",How does the National Diabetes Education Program (NDEP) contribute to reducing the impact of diabetes in the United States?
HF_Diabetes_TR_Translated,Ulusal Diyabet Eğitim Programının (NDEP) temel amacı nedir?,"NDEP'in temel amacı halk ve sağlık profesyonelleri arasında diyabet eğitimini ve farkındalığını teşvik etmektir. Bu, diyabetli bireylerin ve ailelerinin kendi sağlıkları hakkında bilinçli kararlar vermelerini güçlendirmeye yardımcı olur.",What is the primary objective of the National Diabetes Education Program (NDEP)?
HF_Diabetes_TR_Translated,"Ulusal Diyabet Eğitim Programı (NDEP) özel bir girişim mi, yoksa kamuya ait bir girişim mi?","NDEP federal olarak finanse edilen bir programdır, yani Amerika Birleşik Devletleri hükümeti tarafından desteklenmektedir. Bu, ulusal ölçekte erişimini ve etkisini garanti eder.",Is the National Diabetes Education Program (NDEP) a private or public initiative?
HF_Diabetes_TR_Translated,Ulusal Diyabet Eğitim Programı (NDEP) tarafından sağlanan eğitim kaynaklarına bazı örnekler nelerdir?,"NDEP, sağlık uzmanlarına yönelik çevrimiçi materyaller, yayınlar ve eğitim programları da dahil olmak üzere çok çeşitli kaynaklar sunmaktadır. Bu kaynaklar diyabetin yönetimi, önlenmesi ve en son araştırma bulguları hakkında kapsamlı bilgi sağlamayı amaçlamaktadır.",What are some examples of educational resources provided by the National Diabetes Education Program (NDEP)?
HF_Diabetes_TR_Translated,Diyabet araştırmaları ve gelişmeler hakkında güncel bilgiler sağlayan saygın kuruluşlar hangileridir?,"Cevap: Ulusal Diyabet ve Sindirim ve Böbrek Hastalıkları Enstitüsü (NIDDK), Amerikan Diyabet Derneği (ADA) ve Juvenil Diyabet Araştırma Vakfı (JDRF) diyabetle ilgili güvenilir bilgi kaynaklarıdır.",What are some reputable organizations that provide up-to-date information on diabetes research and advancements?
HF_Diabetes_TR_Translated,Bireyler diyabet bakımındaki son gelişmelerden nasıl haberdar olabilir?,"Cevap: Diyabet araştırmaları ve ilerlemeleri hakkında bilgi sahibi olmak NIDDK, ADA ve JDRF gibi web sitelerinin yanı sıra saygın tıp dergileri ve sağlık hizmeti sağlayıcıları aracılığıyla da yapılabilir.",How can individuals stay informed about the latest developments in diabetes care?
HF_Diabetes_TR_Translated,"Bireyler, sağlık hizmeti sağlayıcılarının yanı sıra diyabet yönetimindeki yeni keşifler hakkında bilgi edinmek için başka hangi yolları keşfedebilir?","Cevap: Bireyler, sağlık hizmeti sağlayıcılarının yanı sıra NIDDK, ADA, JDRF gibi kuruluşlardan ve saygın tıp dergilerini okuyarak da güvenilir bilgilere ulaşabilirler.","Besides healthcare providers, what other avenues can individuals explore to learn about new discoveries in diabetes management?"
HF_Diabetes_TR_Translated,Diyabet araştırmalarındaki son gelişmeler hakkında bilgiyi nerede bulabilirim?,"Cevap: NIDDK, ADA ve JDRF gibi web siteleri ve saygın tıp dergileri, diyabet bakımındaki en son gelişmelerden haberdar olmak için mükemmel kaynaklardır.",Where can I find information on recent breakthroughs in diabetes research?
HF_Diabetes_TR_Translated,Diyabetli bireylerin düzenli diş muayenesi neden önemlidir?,"Cevap: Diyabet, diş eti hastalığı ve diğer ağız sağlığı komplikasyonlarının gelişme riskini artırır. Düzenli kontroller, diş hekimlerinin bu sorunları erken tespit edip tedavi etmelerine olanak tanıyarak daha fazla komplikasyonun önlenmesine ve genel sağlığın korunmasına yardımcı olur.",Why are regular dental checkups crucial for individuals with diabetes?
HF_Diabetes_TR_Translated,Diyabetli kişiler hangi spesifik ağız sağlığı sorunlarıyla karşı karşıyadır ve diş muayeneleri bunların üstesinden gelmeye nasıl yardımcı olur?,"Cevap: Diyabetli bireylerde diş eti hastalığı, diş çürümesi ve ağız kuruluğu görülme olasılığı daha yüksektir. Diş muayeneleri, bu sorunları ele alan, ağız sağlığını geliştiren ve genel refaha katkıda bulunan kapsamlı muayeneleri, temizliği ve önleyici tedbirleri içerir.","What specific oral health problems do people with diabetes face, and how do dental checkups help manage them?"
HF_Diabetes_TR_Translated,Düzenli diş muayeneleri diyabetli kişilerin genel sağlığına ve refahına nasıl katkıda bulunur?,"Cevap: Düzenli diş muayeneleri, ağız sağlığı sorunlarını önleyerek ve yöneterek, diyabetli bireylerin düzgün sindirim ve genel sağlık için gerekli olan sağlıklı bir ağız yapısına sahip olmalarına yardımcı olur. Ağız sorunlarının erken tespiti ve tedavisi aynı zamanda vücudun diğer kısımlarını etkileyebilecek komplikasyonları önlemeye de yardımcı olabilir.",How do regular dental checkups contribute to the overall health and well-being of people with diabetes?
HF_Diabetes_TR_Translated,Diyabet ile ağız sağlığı arasındaki bağlantıyı ve düzenli diş kontrollerinin bu ilişkinin yönetilmesinde nasıl bir rol oynadığını açıklayabilir misiniz?,"Cevap: Diyabet, bağışıklık sistemini zayıflatarak bireyleri diş eti hastalıkları da dahil olmak üzere enfeksiyonlara karşı daha duyarlı hale getirir. Düzenli diş muayeneleri, diş eti hastalığının erken tespit edilmesine ve tedavi edilmesine yardımcı olur, daha fazla komplikasyonun önlenmesine ve diyabetli bireylerin genel sağlığı için çok önemli olan sağlıklı bir ağzın desteklenmesine yardımcı olur.","Can you explain the link between diabetes and oral health, and how regular dental checkups play a role in managing this relationship?"
HF_Diabetes_TR_Translated,Bağışıklık sistemlerinin zayıf olduğu göz önüne alındığında aşılar diyabetli bireylere nasıl fayda sağlar?,"Cevap: Aşılar, virüs veya bakterilerin zayıflamış veya aktif olmayan bir formunu vücuda sokarak bağışıklık sistemini güçlendirir. Bu, vücudun, enfeksiyonlara karşı daha duyarlı olan diyabetli bireyler için çok önemli olan, tam gelişmiş hastalık yaşamadan bağışıklık geliştirmesine olanak tanır.","How do vaccinations benefit individuals with diabetes, considering their weakened immune systems?"
HF_Diabetes_TR_Translated,Diyabetle ilişkili hangi spesifik sağlık riskleri aşıları özellikle gerekli kılmaktadır?,"Cevap: Diyabet, yara iyileşmesinin bozulması ve kan şekeri kontrolünün bozulması gibi komplikasyonlara yol açarak bireyleri ciddi enfeksiyonlara karşı daha savunmasız hale getirebilir. Aşılar önlenebilir hastalıklara karşı koruma sağlayarak bu komplikasyonları önlemeye yardımcı olur.",What specific health risks associated with diabetes make vaccinations particularly essential?
HF_Diabetes_TR_Translated,Aşılar diyabetli bireylerin yaygın hastalıkların neden olduğu komplikasyonları önlemelerine ne şekilde yardımcı olabilir?,"Cevap: Aşılar, özellikle diyabet hastaları için tehlikeli olabilecek grip, zatürre ve tetanoz gibi yaygın hastalıklardan kaynaklanan ciddi komplikasyonların gelişme riskini önemli ölçüde azaltabilir.",In what ways can vaccinations help individuals with diabetes avoid complications from common illnesses?
HF_Diabetes_TR_Translated,Diyabetli bireylerin genel popülasyona göre daha geniş bir yelpazede aşı yaptırması gerekli midir?,"Cevap: Evet, zayıf bağışıklık sistemleri onları çeşitli enfeksiyonlara karşı daha savunmasız hale getirdiğinden, diyabetli bireyler sıklıkla daha geniş bir aşı yelpazesine ihtiyaç duyarlar. Her bir birey için gereken spesifik aşıları belirlemek için bir sağlık uzmanına danışmak çok önemlidir.",Is it necessary for individuals with diabetes to receive a broader range of vaccinations compared to the general population?
HF_Diabetes_TR_Translated,"Diyabetli bireyler için ""Her Ziyarette Sağlık Ekibinizle Görüşülmesi Gerekenler"" çizelgesinin temel işlevi nedir?","Yanıt: Tablo, diyabetli bireyler ile sağlık hizmeti sunucuları arasında açık iletişimi kolaylaştıran değerli bir araç görevi görerek diyabet yönetiminin temel yönlerinin kapsamlı bir şekilde tartışılmasını ve ele alınmasını sağlar.","What is the primary function of the ""Things to Discuss with Your Health Care Team at Each Visit"" chart for individuals with diabetes?"
HF_Diabetes_TR_Translated,"""Her Ziyarette Sağlık Ekibinizle Görüşülmesi Gerekenler"" tablosu etkili diyabet bakımına nasıl katkıda bulunur?","Yanıt: Diyabetli bireyleri ilgili konuları sağlık hizmeti sağlayıcılarıyla görüşmeye teşvik eden bu çizelge, diyabet yönetiminin tüm yönleriyle ele alınmasına yardımcı olarak daha kapsamlı ve etkili bir bakım sağlanmasına yardımcı olur.","How does the ""Things to Discuss with Your Health Care Team at Each Visit"" chart contribute to effective diabetes care?"
HF_Diabetes_TR_Translated,"Diyabetli bireylerin ""Her Muayenede Sağlık Ekibinizle Görüşülmesi Gerekenler"" tablosunu kullanması neden faydalıdır?","Cevap: Tablonun kullanılması, diyabetli bireylere, temel konuları sağlık hizmeti sağlayıcılarıyla tartışmaları gerektiğini hatırlatarak, kendi bakımlarına aktif olarak katılmalarını sağlar ve diyabet yönetimine daha işbirlikçi ve bilgili bir yaklaşımı teşvik eder.","Why is it beneficial for individuals with diabetes to use the ""Things to Discuss with Your Health Care Team at Each Visit"" chart?"
HF_Diabetes_TR_Translated,"""Her Muayenede Sağlık Ekibinizle Görüşülmesi Gerekenler"" tablosuna göre diyabetli bireyler her ziyarette sağlık ekibiyle ne tür bilgileri görüşmeye öncelik vermelidir?","Cevap: Tablo, diyabetli bireyleri, kan şekeri düzeyleri, ilaçlar, yaşam tarzı değişiklikleri ve olabilecek endişeler veya sorular gibi diyabet yönetiminin temel yönlerini tartışmaya teşvik ederek, onların bakımına bütünsel ve çok yönlü bir yaklaşım sağlar.","What kind of information should individuals with diabetes prioritize discussing with their healthcare team during each visit, based on the ""Things to Discuss with Your Health Care Team at Each Visit"" chart?"
HF_Diabetes_TR_Translated,Diyabetli kişilerde kan basıncı düzeylerini yakından takip etmek neden önemlidir?,"Cevap: Diyabetli bireylerin, diyabet ile yüksek tansiyon arasındaki ilişki nedeniyle kardiyovasküler komplikasyon geliştirme riski daha yüksektir. Düzenli izleme, potansiyel sorunların erken tespit edilmesine yardımcı olur ve ciddi sağlık sonuçlarını önlemek için zamanında müdahale edilmesine olanak tanır.",Why is it essential to keep a close eye on blood pressure levels in people with diabetes?
