source,question_tr,answer_tr,question_en
HF_Diabetes_TR_Translated,Diyabetli bireylerin diyabet araştırmaları ve eğitimine ilişkin politika kararlarını etkilemesi için etkili yöntemler nelerdir?,"Yanıt: Lobi faaliyetleri yoluyla politika yapıcılarla etkileşime geçmek, kamuya açık oturumlara katılmak ve seçilmiş yetkililerle temasa geçmek çok önemli adımlardır. Kişisel deneyimlerin paylaşılması ve finansmanın artırılmasının savunulması, politika kararlarını önemli ölçüde etkileyebilir.",What are some effective methods for individuals with diabetes to influence policy decisions regarding diabetes research and education?
HF_Diabetes_TR_Translated,"Diyabetli bireyler, diyabet araştırması ve eğitiminin önemi konusunda farkındalığın artırılmasına nasıl katkıda bulunabilir?","Cevap: Diyabet organizasyonlarını desteklemek, farkındalık kampanyalarına katılmak ve kişisel hikayeleri sosyal medya platformlarında paylaşmak, farkındalığı etkili bir şekilde artırabilir. Bu eylemler halkın eğitilmesine yardımcı olur ve daha fazla araştırma ve desteğe olan ihtiyacı vurgular.",How can individuals with diabetes contribute to raising awareness about the importance of diabetes research and education?
HF_Diabetes_TR_Translated,"Politika yapıcılarla doğrudan etkileşimin ötesinde, diyabetli bireyler kendi toplumlarında araştırma ve eğitimi teşvik etmek için başka hangi yolları kullanabilirler?","Cevap: Bireyler yerel etkinlikler düzenleyebilir, bağış toplama faaliyetlerine katılabilir ve diyabet organizasyonlarına gönüllü olarak katılabilir. Bu çabalar, kendi topluluklarında araştırma ve eğitim girişimleri için destekleyici bir ortam yaratılmasına katkıda bulunmaktadır.","Beyond direct engagement with policymakers, what other ways can individuals with diabetes promote research and education in their community?"
HF_Diabetes_TR_Translated,Diyabet araştırmaları ve eğitimini savunurken kişisel hikayeleri paylaşmanın önemi nedir?,"Cevap: Kişisel hikayelerin paylaşılması, diyabetli bireylerin karşılaştığı zorlukları ve çözüm bulmanın önemini vurgulayarak insanlarla duygusal düzeyde bağ kurabilir. Bu hikayeler farkındalık yaratmak ve destek oluşturmak için güçlü araçlar olabilir.",What is the significance of sharing personal stories in advocating for diabetes research and education?
HF_Diabetes_TR_Translated,Yiyeceklerden kolayca temin edilemediğinde vücut glikozu nasıl üretir?,"Vücut, özellikle karaciğer ve kaslarda, özellikle glukoneogenez adı verilen bir süreç yoluyla, gıda dışındaki kaynaklardan glikoz oluşturabilir.",How does the body produce glucose when it's not readily available from food?
HF_Diabetes_TR_Translated,Vücudun enerji üretiminde karaciğer ve kasların birincil rolü nedir?,"Glikozu doğrudan gıdalardan elde etmenin yanı sıra, karaciğer ve kaslar, glukoneogenez yoluyla glikoz üretiminde önemli bir rol oynayarak vücuda istikrarlı bir enerji tedariki sağlar.",What is the primary role of the liver and muscles in the body's energy production?
HF_Diabetes_TR_Translated,Vücut kendi glikozunu üretebilir mi ve eğer öyleyse bu nerede oluyor?,"Evet, vücut, esas olarak karaciğerde ve kaslarda meydana gelen glukoneogenez yoluyla glikoz üretebilir. Bu süreç, glikoz alımı yetersiz olduğunda enerji seviyelerini korumak için gereklidir.","Can the body make its own glucose, and if so, where does this happen?"
HF_Diabetes_TR_Translated,Vücudun enerji dengesi için karaciğer ve kaslardaki glukoneogenezin önemini açıklayın.,"Karaciğerde ve kaslarda glikoz üretme süreci olan glukoneogenez, özellikle glikoz alımı düşük olduğunda enerji dengesini korumak için çok önemlidir. Vücudun fonksiyonları için sürekli enerji temini sağlar.",Explain the significance of gluconeogenesis in the liver and muscles for the body's energy balance.
HF_Diabetes_TR_Translated,Kitapçık aileyi ve arkadaşları diyabet konusunda bilgilendirmek için hangi spesifik yöntemi öneriyor?,"Cevap: Kitapçık, onları diyabet konusunda eğitmek ve desteklerini teşvik etmek amacıyla kitapçığın aile ve arkadaşlarla paylaşılmasını önermektedir.",What specific method does the booklet propose for informing family and friends about diabetes?
HF_Diabetes_TR_Translated,Kitapçık neden bunu diyabet hastası olmayan sevdiklerinizle paylaşmanızı öneriyor?,"Cevap: Kitapçık, aile ve arkadaşların diyabeti daha iyi anlamalarını sağlamak ve onların daha bilgili ve yararlı destek sunabilmelerini sağlamak için paylaşımı teşvik etmektedir.",Why does the booklet suggest sharing it with loved ones who may not have diabetes?
HF_Diabetes_TR_Translated,Kitapçıkta diyabetle ilgili bilgilerin başkalarıyla paylaşılması için önerilen temel araç nedir?,"Cevap: Kitapçığın kendisi, diyabet hakkındaki bilgilerin aile ve arkadaşlarla paylaşılmasında birincil araç olarak sunulmaktadır.","In the booklet, what is the primary tool suggested for sharing information about diabetes with others?"
HF_Diabetes_TR_Translated,"Kitapçık, diyabetle ilgili bilgilerin sevdiklerinizle paylaşılması konusunda doğrudan konuşmayı mı yoksa farklı bir yaklaşımı mı öneriyor?","Cevap: Kitapçık, kitapçığın kendisinin paylaşılmasını öneriyor ve aileye ve arkadaşlara diyabet hakkında bilgi sağlamaya yönelik dolaylı bir yaklaşımı ima ediyor.",Is the booklet recommending a direct conversation or a different approach to sharing information about diabetes with loved ones?
HF_Diabetes_TR_Translated,İnsülin almayan tip 2 diyabetli bireyler için hangi beslenme stratejileri kan şekeri düzeylerini yönetmeye yardımcı olabilir?,"Cevap: İnsülin almayan tip 2 diyabetli bireyler, kan şekerindeki ciddi dalgalanmaları önlemek için dengeli öğünlere ve düzenli atıştırmalara odaklanan sağlıklı bir beslenme planına öncelik vermelidir. Bu, gün boyunca birkaç büyük öğün yerine birkaç küçük öğün tüketmeyi içerebilir.","For individuals with type 2 diabetes not taking insulin, what dietary strategies can help manage their blood sugar levels?"
HF_Diabetes_TR_Translated,İnsülin kullanmayan tip 2 diyabet hastalarında yemek sıklığı ve potansiyel hipoglisemi konusunda hatırlanması gereken bazı önemli noktalar nelerdir?,"Cevap: İnsülin almayan tip 2 diyabetli bireyler kan şekerinin düşmesini önlemek için öğün atlamaktan kaçınmalıdır. Ayrıca, özellikle diyabet ilaçları alıyorlarsa, kan şekeri düzeylerinin düşük olabileceği ihtimaline karşı da dikkatli olmalıdırlar; çünkü bunlar bazen hipoglisemiye neden olabilir.",What are some key points to remember regarding meal frequency and potential hypoglycemia for type 2 diabetics who are not on insulin?
HF_Diabetes_TR_Translated,İnsülin kullanmayan tip 2 diyabetli bireyler için tutarlı yemek düzeninin önemini açıklayabilir misiniz?,"Cevap: İnsülin almayan tip 2 diyabet hastalarında kan şekeri düzeylerini yönetmek için tutarlı yemek düzenleri çok önemlidir. Sağlıklı bir beslenme planını takip etmek ve öğünlerin atlanmasından kaçınmak, kan şekerinin düzenlenmesine ve hem iniş hem de çıkışların önlenmesine yardımcı olur.",Can you explain the importance of consistent meal patterns for individuals with type 2 diabetes who are not on insulin?
HF_Diabetes_TR_Translated,İnsülin kullanmayan tip 2 diyabet hastalarının özellikle diyabet ilaçları alırken kan şekeri düzeyleri açısından nelere dikkat etmesi gerekir?,"Cevap: İnsülin almayan Tip 2 diyabet hastaları, özellikle de diyabet ilacı kullananlar, olası düşük kan şekeri düzeylerine karşı dikkatli olmalıdır. Bu ilaçlar bazen kan şekerini çok fazla düşürebilir, bu nedenle yemek düzeninin izlenmesi ve ayarlanması önemlidir.","What considerations should be made by type 2 diabetics who are not taking insulin regarding their blood sugar levels, especially when taking diabetes medications?"
HF_Diabetes_TR_Translated,Fiziksel aktivite insülinin kan şekerini kontrol etme etkinliğini nasıl artırır?,"Cevap: Düzenli fiziksel aktivite insülin duyarlılığını arttırır, yani hücreler insüline daha duyarlı hale gelir. Bu gelişmiş hassasiyet, hücrelerin kan dolaşımından glikozu daha verimli bir şekilde almasına olanak tanır ve kan şekeri seviyelerinin düşmesine yol açar.",How does physical activity improve the effectiveness of insulin in controlling blood sugar?
HF_Diabetes_TR_Translated,İnsülinin etkinliğini artırmak için fiziksel aktivite hangi spesifik mekanizmayı kullanır?,Cevap: Fiziksel aktivite öncelikle hücre yüzeylerindeki glikoz taşıyıcılarının sayısını artırarak insülin duyarlılığını artırır. Bu taşıyıcılar bir kapı görevi görerek glikozun hücrelere girmesine ve enerji için kullanılmasına izin vererek sonuçta kan şekeri seviyelerini düşürür.,What specific mechanism does physical activity utilize to increase insulin's effectiveness?
HF_Diabetes_TR_Translated,"Fiziksel aktivite, kan şekeri düzeylerini yönetmek için bir insülin tedavisi şekli olarak düşünülebilir mi?","Yanıt: Doğrudan insülin tedavisinin yerine geçmese de, fiziksel aktivite kan şekeri düzeylerini yönetmek için tamamlayıcı bir strateji olarak düşünülebilir. Fiziksel aktivite, insülin duyarlılığını artırarak diyabetli bireylerin kan şekeri seviyelerini daha iyi düzenlemelerine yardımcı olur.",Can physical activity be considered a form of insulin therapy for managing blood sugar levels?
HF_Diabetes_TR_Translated,İnsülin direnci olan bireyler için fiziksel aktivitede bulunmanın temel faydaları nelerdir?,"Cevap: İnsülin direnci olan kişiler için fiziksel aktivite çok önemlidir çünkü insülin duyarlılığını önemli ölçüde artırır ve vücutlarının glikozu daha etkili bir şekilde kullanmasını sağlar. Bu, daha iyi kan şekeri kontrolüne ve tip 2 diyabet gelişme riskinin azalmasına yol açar.",What are the key benefits of engaging in physical activity for individuals with insulin resistance?
HF_Diabetes_TR_Translated,Çocuklar ve ergenler için okul dışında ne kadar ekran süresi öneriliyor?,Cevap: Çocuk ve ergenlerin okulla ilgisi olmayan ekran süresini günde 2 saatten daha az olacak şekilde sınırlamaları önerilir.,How much screen time is recommended for children and adolescents outside of school?
HF_Diabetes_TR_Translated,Çocuklar ve ergenler için ekran süresini sınırlamanın sağlık açısından faydaları nelerdir?,"Cevap: Ekran başında geçirilen sürenin sınırlandırılması, daha fazla fiziksel aktiviteyi teşvik eder ve diyabetin daha iyi yönetilmesine katkıda bulunabilir.",What are the health benefits of limiting screen time for children and adolescents?
HF_Diabetes_TR_Translated,Çocukların ve ergenlerin ekran başında geçirdikleri süreyi sınırlamaları neden önemlidir?,"Cevap: Ekran başında geçirilen sürenin azaltılması, fiziksel aktiviteyi teşvik eder ve diyabetin yönetilmesine yardımcı olarak genel sağlık ve refaha katkıda bulunabilir.",Why is it important for children and adolescents to limit their screen time?
HF_Diabetes_TR_Translated,Çocuklara ve ergenlere yönelik ekran başında kalma önerilerinin ardındaki mantığı açıklayabilir misiniz?,"Cevap: Ekran başında kalma süresinin günde 2 saatten daha az olacak şekilde sınırlandırılması önerisi, fiziksel aktiviteyi teşvik etme ve diyabet yönetimini iyileştirme arzusuna dayanmaktadır.",Can you explain the rationale behind the screen time recommendations for children and adolescents?
HF_Diabetes_TR_Translated,Kas güçlendirici aktivitelere ne sıklıkla katılmanız önerilir?,"Kitapçık, haftada en az iki kez mekik veya halter gibi kasları ve kemikleri güçlendiren kas güçlendirici aktivitelere katılmanızı öneriyor.",How often is it recommended to engage in muscle-strengthening activities?
HF_Diabetes_TR_Translated,Kas ve kemik gücünü artırmak için ne tür egzersizler önerilir?,"Kitapçık, haftada en az iki kez mekik çekme veya ağırlık kaldırma gibi kasları ve kemikleri güçlendiren aktivitelerin dahil edilmesini öneriyor.",What kinds of exercises are suggested for improving muscle and bone strength?
HF_Diabetes_TR_Translated,Kitapçıkta önerilen kas güçlendirici aktiviteye örnek verebilir misiniz?,Kitapçıkta kasları ve kemikleri güçlendirmek için mekik veya halter gibi aktiviteler öneriliyor.,Can you provide an example of a muscle-strengthening activity recommended in the booklet?
HF_Diabetes_TR_Translated,Önerilen bu aktiviteler kasları güçlendirmenin yanı sıra başka ne gibi faydalar sağlar?,Kitapçıkta mekik veya halter gibi sadece kasları güçlendirmekle kalmayıp kemik sağlığına da fayda sağlayan aktiviteler öneriliyor.,"Besides strengthening muscles, what other benefit do these recommended activities provide?"
HF_Diabetes_TR_Translated,İnsülin alan bireyler için yatma saatine yakın egzersiz yapmanın potansiyel riskleri nelerdir?,"Yatmadan önce egzersiz yapmak, insülin alan kişilerde gece hipoglisemisine veya uyku sırasında kan şekerinin düşmesine neden olabilir. Bunun nedeni insülinin etkilerinin uzayabilmesi ve fiziksel aktivitenin kan şekeri düzeylerini düşürebilmesidir.",What are the potential risks of exercising close to bedtime for individuals taking insulin?
HF_Diabetes_TR_Translated,"Fiziksel aktivite, özellikle yatma saatine yakın yapıldığında insülin alan bireylerde kan şekeri düzeylerini nasıl etkiler?",Fiziksel aktivite kan şekeri düzeylerini düşürür ve insülinin etkileri birkaç saat sürebildiği için yatma saatine yakın egzersiz yapmak uyku sırasında kan şekeri düzeylerinin tehlikeli derecede düşük olmasına neden olabilir.,"How does physical activity impact blood sugar levels in individuals taking insulin, especially when done close to bedtime?"
HF_Diabetes_TR_Translated,İnsülin alan kişilerin yatmadan önceki saatlerde yorucu egzersizlerden kaçınması neden önemlidir?,Yorucu egzersiz kan şekeri düzeylerini önemli ölçüde düşürebilir ve insülin kullananlar için bu etki uyku sırasında da devam edebilir ve potansiyel olarak gece hipoglisemisine yol açabilir.,Why is it important for individuals taking insulin to avoid strenuous exercise in the hours leading up to bedtime?
HF_Diabetes_TR_Translated,"Yatmadan önce fiziksel aktivite yapmak, insülin kullanıcıları için uyku sırasında kan şekeri düşüklüğü yaşama riskini artırabilir mi?","Evet, yatma saatine yakın fiziksel aktivite, insülin kullanıcıları için gece hipoglisemisi riskini artırabilir. Bunun nedeni, insülinin etkilerinin uzayabilmesi ve egzersizin kan şekeri düzeylerini düşürmesidir.",Could engaging in physical activity before bed increase the risk of experiencing low blood sugar during sleep for insulin users?
HF_Diabetes_TR_Translated,İnsülin iğnelerini veya kalemlerini paylaşmanın hangi sağlık riskleri vardır?,"Cevap: İnsülin iğnelerinin veya kalemlerinin paylaşılması, HIV ve hepatit gibi kan yoluyla bulaşan ciddi enfeksiyonların bulaşmasına yol açarak önemli bir sağlık riski oluşturabilir.",What health risks are associated with sharing insulin needles or pens?
HF_Diabetes_TR_Translated,İnsülin iğnelerini veya kalemlerini paylaşmak hastalıkların bulaşmasına neden olabilir mi?,"Cevap: Evet, insülin iğnelerinin veya kalemlerinin paylaşılması HIV ve hepatit gibi kan yoluyla bulaşan enfeksiyonların bulaşmasına neden olarak bireyleri risk altına sokabilir.",Can sharing insulin needles or pens result in the transmission of diseases?
HF_Diabetes_TR_Translated,İnsülin iğnelerini veya kalemlerini başkalarıyla paylaşmak neden tehlikelidir?,"Cevap: İnsülin iğnelerinin veya kalemlerinin paylaşılması, sağlık açısından ciddi sonuçlara yol açabilecek HIV ve hepatit gibi kan yoluyla bulaşan enfeksiyonların bulaşması açısından yüksek risk oluşturur.",Why is it dangerous to share insulin needles or pens with others?
HF_Diabetes_TR_Translated,İnsülin iğnelerini veya kalemlerini paylaşarak yayılabilecek bazı enfeksiyon örnekleri nelerdir?,"Cevap: İnsülin iğnelerinin veya kalemlerinin paylaşılması, HIV ve hepatit dahil olmak üzere kan yoluyla bulaşan ciddi enfeksiyonların bulaşmasına yol açabilir.",What are some examples of infections that can be spread through sharing insulin needles or pens?
HF_Diabetes_TR_Translated,İnsülin jet enjektörünün geleneksel iğne bazlı insülin verme yöntemlerinden farkı nedir?,"İnsülin jet enjektörleri, yüksek basınçlı hava kullanarak ince bir sprey yoluyla insülini iletir ve iğne ihtiyacını ortadan kaldırır. Bu, geleneksel enjeksiyonlara göre potansiyel olarak daha az ağrılı ve daha kullanışlı bir alternatif sağlar.",How does an insulin jet injector differ from traditional needle-based insulin delivery methods?
HF_Diabetes_TR_Translated,Diyabetli bireylerde insülin jet enjektörü kullanmanın birincil faydası nedir?,"İnsülin jet enjektörlerinin ana avantajı, insülin uygulamasını birçok insan için daha az ağrılı ve daha rahat hale getirebilen iğnesiz dağıtım sistemidir.",What is the primary benefit of using an insulin jet injector for individuals with diabetes?
HF_Diabetes_TR_Translated,İnsülin jet enjektörlerinin insülini iletme mekanizmasını açıklayabilir misiniz?,"İnsülin jet enjektörleri, yüksek basınçlı hava kullanarak ince bir insülin spreyi oluşturarak daha sonra cilde iletilir. Bu, iğne ihtiyacını ortadan kaldırarak potansiyel olarak ağrı ve rahatsızlığı azaltır.",Can you explain the mechanism by which insulin jet injectors deliver insulin?
HF_Diabetes_TR_Translated,İğnesiz olmanın yanı sıra insülin jet enjektörü kullanmanın başka avantajları var mı?,"İnsülin jet enjektörleri iğnesiz olmalarının yanı sıra geleneksel yöntemlere göre daha fazla kolaylık ve kullanım kolaylığı da sunabilmektedir. Bunun nedeni, çeşitli ortamlarda kullanılabilmeleri ve daha az hazırlık gerektirmeleridir.","Besides being needle-free, are there any other advantages to using an insulin jet injector?"
HF_Diabetes_TR_Translated,Diyabet hastalarına neden sıklıkla düşük doz aspirin reçete ediliyor?,"Diyabetin kardiyovasküler problem riskini arttırması nedeniyle, kalp hastalığını önlemeye yardımcı olmak için diyabet hastalarına sıklıkla düşük dozda aspirin reçete edilir.",Why is low-dose aspirin frequently prescribed for diabetic patients?
HF_Diabetes_TR_Translated,Diyabetli kişiler için düşük dozda aspirin almanın başlıca kardiyovasküler faydası nedir?,"Diyabetli kişiler için düşük dozda aspirin almanın başlıca kardiyovasküler faydası, bu popülasyon için önemli bir endişe kaynağı olan kalp hastalığı riskinin azalmasıdır.",What is the primary cardiovascular benefit of taking low-dose aspirin for people with diabetes?
HF_Diabetes_TR_Translated,Düşük doz aspirin diyabetli bireylerde kalp sorunları riskini azaltmaya yardımcı olabilir mi? Nedenini açıklayın.,"Evet, düşük dozda aspirin diyabetli bireylerde kalp sorunları riskinin azaltılmasına yardımcı olabilir. Bunun nedeni, diyabetin artan kardiyovasküler hastalık riskiyle ilişkili olması ve aspirinin kanın incelmesine yardımcı olarak kalp krizi ve felce yol açabilecek kan pıhtılaşması olasılığını azaltmasıdır.",Can low-dose aspirin help reduce the risk of heart problems in individuals with diabetes? Explain why.
HF_Diabetes_TR_Translated,Diyabet tedavisinde düşük doz aspirini önermenin ardındaki mantık nedir?,"Diyabet yönetimi için düşük dozda aspirin önerilmesinin ardındaki mantık, diyabetli bireylerin kardiyovasküler sorunlara daha duyarlı olmaları ve aspirinin kanı sulandırıcı özelliklerinin kalp hastalığı riskini azaltmaya yardımcı olmasıdır.",What is the rationale behind recommending low-dose aspirin for diabetes management?
HF_Diabetes_TR_Translated,İnsanların diyabet ilaç programına uymaya çalışırken karşılaştıkları bazı yaygın zorluklar nelerdir?,"Cevap: En büyük zorluklardan biri ilacı doğru zamanda almayı hatırlamaktır. Yoğun programlar, unutkanlık ve dikkat dağıtıcı unsurların tümü doğru yolda kalmayı zorlaştırabilir.",What are some common difficulties people face when trying to stick to a diabetes medication schedule?
HF_Diabetes_TR_Translated,Diyabet ilaçlarını tutarlı bir şekilde almayı hatırlamak için yararlı stratejiler var mı?,Cevap: Evet var! Her gün ve saat için bölmeleri olan bir hap saklama kutusu kullanmak çok etkili olabilir. Telefonunuza hatırlatıcılar ayarlamak veya bir ilaç takip uygulaması kullanmak da yararlı olabilir.,Are there any helpful strategies for remembering to take diabetes medication consistently?
HF_Diabetes_TR_Translated,"Haftalık bir ilaç kutusu, diyabetli kişilerin ilaç rutinlerini yönetmelerine nasıl yardımcı olabilir?","Cevap: Haftalık bir ilaç kutusu, insanların ilaçlarını her gün ve saat için önceden sıralamasına olanak tanır ve dozlarını almayı hatırlamayı çok daha kolay hale getirir. Bu özellikle seyahat eden veya yoğun programları olan kişiler için yararlı olabilir.",How can a weekly pill box help people with diabetes manage their medication routine?
HF_Diabetes_TR_Translated,Diyabet ilaçlarını doğru zamanlarda almak neden bu kadar önemli?,"Cevap: İlacın doğru zamanda alınması, kan şekeri seviyelerinin yönetilmesi ve komplikasyonların önlenmesi açısından çok önemlidir. Tutarsız ilaç programları kan şekerinde tehlikeli olabilecek dalgalanmalara neden olabilir.",Why is it so important to take diabetes medication at the correct times?
HF_Diabetes_TR_Translated,Geleneksel kan şekeri testiyle karşılaştırıldığında sürekli glikoz izleme (CGM) tarafından sağlanan verilerdeki temel farklar nelerdir?,"CGM, sürekli, gerçek zamanlı kan şekeri ölçümleri sunarak gün ve gece boyunca glikoz dalgalanmalarının kapsamlı bir görünümünü sağlar. Öte yandan, geleneksel kan şekeri testi, parmaktan delme testleri yoluyla aralıklı ölçümler sağlar ve yalnızca glikoz seviyelerinin anlık görüntülerini sunar.",What are the key differences in the data provided by continuous glucose monitoring (CGM) compared to traditional blood glucose testing?
HF_Diabetes_TR_Translated,"Sürekli glikoz izleme, geleneksel kan şekeri testinin sınırlamalarına göre nasıl iyileşir?","Sürekli glikoz izleme, sık sık parmakla delme testlerine olan ihtiyacı ortadan kaldırarak, kan şekeri seviyelerini izlemenin daha rahat ve daha az müdahaleci bir yolunu sağlar. Aynı zamanda glikoz dalgalanmalarının daha eksiksiz bir resmini sunarak diyabetin ve potansiyel komplikasyonların daha iyi yönetilmesini sağlar.",How does continuous glucose monitoring improve upon the limitations of traditional blood sugar testing?
HF_Diabetes_TR_Translated,Sürekli glikoz takibinin geleneksel kan şekeri testine göre avantajlarını açıklayabilir misiniz?,"Sürekli glikoz izleme, kan şekeri düzeylerine ilişkin gerçek zamanlı bilgiler, potansiyel sorunların erken tespiti ve diyabetin daha iyi yönetimi dahil olmak üzere çeşitli avantajlar sunar. Bireylerin diyetleri, egzersizleri ve ilaçları hakkında daha bilinçli kararlar vermelerine olanak tanır.",Can you explain the advantages of using continuous glucose monitoring over traditional blood sugar testing?
HF_Diabetes_TR_Translated,"Sürekli glikoz izleme, geleneksel yöntemlere kıyasla kan şekeri düzenlerinin daha ayrıntılı anlaşılmasını hangi yollarla sağlar?","Sürekli glikoz izleme, gün ve gece boyunca kan şekeri seviyelerindeki hem yüksek hem de düşük seviyeleri yakalayan sürekli bir veri akışı sağlar. Bu ayrıntılı bilgi, bireylerin ve sağlık hizmeti sağlayıcılarının, geleneksel kan şekeri testlerinde gözden kaçabilecek eğilimleri ve modelleri belirlemesine olanak tanır.",In what ways does continuous glucose monitoring provide a more detailed understanding of blood sugar patterns compared to traditional methods?
HF_Diabetes_TR_Translated,A1C testi diyabetin yönetilmesinde nasıl yardımcı olur?,"A1C testi, son 2-3 aydaki ortalama kan şekeri seviyelerinizin anlık görüntüsünü sağlar. Bu bilgi, sağlık profesyonellerinin diyabet yönetim planınızın etkinliğini değerlendirmesine ve ilaç, diyet veya yaşam tarzı değişikliklerinde gerekli ayarlamaları yapmasına yardımcı olur.",How does the A1C test help in managing diabetes?
HF_Diabetes_TR_Translated,Yüksek A1C değeri diyabetik bir hastanın yönetim planı hakkında ne gösterir?,"Yüksek bir A1C değeri, mevcut diyabet yönetim planının kan şekeri düzeylerini etkili bir şekilde kontrol etmediğini göstermektedir. İlaç tedavisinin arttırılması, diyet değişiklikleri veya daha sık takip gibi tedavi planında ayarlama yapılması ihtiyacını gösterir.",What does a high A1C reading indicate about a diabetic patient's management plan?
HF_Diabetes_TR_Translated,Hedef A1C okuması başarılı diyabet yönetiminin bir işareti olarak değerlendirilebilir mi?,"Evet, bireysel hastalar için önerilen aralık dahilindeki hedef A1C okuması, mevcut diyabet yönetim planının iyi çalıştığını gösterir. Kan şekeri seviyelerinin iyi kontrol edildiğini ve uzun vadeli komplikasyon riskini azalttığını öne sürüyor.",Can a target A1C reading be considered a sign of successful diabetes management?
