source,question_tr,answer_tr,question_en
HF_Diabetes_TR_Translated,"""Yılda En Az Bir veya İki Kez Yaptırılması Gereken Testler, Muayeneler ve Aşılar"" tablosu diyabetli bireylerin sağlıklarını yönetmelerine nasıl destek oluyor?","Tablo, önerilen testler, muayeneler ve aşılardan oluşan bir kontrol listesi sunarak diyabetli bireyleri destekliyor, onların sağlık bakım ihtiyaçlarını karşılamalarına yardımcı oluyor, proaktif yönetimi teşvik ediyor ve potansiyel sağlık sorunlarının erken tespitini teşvik ediyor.","In what way does the ""Tests, Exams, and Vaccines to Get at Least Once or Twice a Year"" chart support individuals with diabetes in managing their health?"
HF_Diabetes_TR_Translated,"""Yılda En Az Bir veya İki Kez Yapılması Gereken Testler, Muayeneler ve Aşılar"" tablosu diyabetli bireylerin genel refahına nasıl katkıda bulunuyor?","Tablo, diyabetli bireylerin sağlık sorunlarının erken tespitine ve yönetimine yardımcı olabilecek düzenli testler, muayeneler ve aşılar aracılığıyla proaktif sağlık hizmetlerine katılmalarını teşvik ederek genel refahına katkıda bulunuyor.","How does the ""Tests, Exams, and Vaccines to Get at Least Once or Twice a Year"" chart contribute to the overall well-being of individuals with diabetes?"
HF_Diabetes_TR_Translated,Kan lipitlerinde hangi spesifik yağ türleri bulunur ve bunların diyabetle nasıl bir ilişkisi vardır?,"Kan lipitleri, her ikisi de kan dolaşımında dolaşan yağ olan kolesterol ve trigliseritlerden oluşur.  Diyabetli bireyler sıklıkla bu yağların daha yüksek seviyelerini yaşarlar; bu, dislipidemi adı verilen ve kardiyovasküler komplikasyonlara yol açabilen bir durumdur.","What specific types of fats are included in blood lipids, and how do they relate to diabetes?"
HF_Diabetes_TR_Translated,Diyabetli bireylerin kan lipit düzeylerini izlemesi neden önemlidir?,Diyabetli bireylerde kan lipitlerinin izlenmesi çok önemlidir çünkü yüksek kolesterol ve trigliserit seviyeleri kalp hastalığı ve felç riskini artırabilir.  Sağlık hizmeti sağlayıcıları bu seviyeleri takip ederek bu riskleri yönetmek ve kalp sağlığını korumak için stratejiler uygulayabilir.,Why is it essential for individuals with diabetes to monitor their blood lipid levels?
HF_Diabetes_TR_Translated,Diyabet ile dislipidemi gelişimi arasındaki bağlantıyı açıklayın.,"Diyabet sıklıkla anormal kan lipit seviyeleri ile karakterize edilen bir durum olan dislipidemiye yol açar.  Bunun nedeni, diyabetin ayırt edici özelliği olan insülin direncinin, vücudun lipit metabolizmasını düzenleme yeteneğini bozabilmesi ve bunun sonucunda kolesterol ve trigliseritlerin yükselmesine neden olabilmesidir.",Explain the link between diabetes and the development of dyslipidemia.
HF_Diabetes_TR_Translated,Diyabetik hastalarda kan lipid takibini ihmal etmenin potansiyel sonuçları nelerdir?,"Diyabetik hastalarda kan lipid takibinin göz ardı edilmesi ciddi sonuçlara yol açabilir.  Yüksek lipit seviyeleri, kalp krizi, felç ve kalple ilgili diğer komplikasyon riskini artırarak kardiyovasküler hastalıkların gelişmesine katkıda bulunur.",What are the potential consequences of neglecting blood lipid monitoring in diabetic patients?
HF_Diabetes_TR_Translated,Böbrek fonksiyon testleri diyabetli bireylerin sağlıklarını yönetmelerine nasıl yardımcı olur?,"Böbrek fonksiyon testleri, böbreklerin atıkları filtreleme yeteneği hakkında önemli bilgiler sağlar. Diyabet böbreklere zarar verebilir ve potansiyel olarak diyabetik böbrek hastalığına yol açabilir. Düzenli testler, sağlık profesyonellerinin böbrek sağlığını izlemesine, sorunları erken tespit etmesine ve daha fazla hasarı önlemek için uygun yönetim stratejilerini uygulamasına olanak tanır.",How do kidney function tests help individuals with diabetes manage their health?
HF_Diabetes_TR_Translated,Diyabetli bireylerde böbrek fonksiyon testlerinin ihmal edilmesinin potansiyel sonuçları nelerdir?,"Diyabetli bireylerde böbrek fonksiyon testlerinin göz ardı edilmesi zararlı olabilir. Diyabete bağlı böbrek hasarı sessizce ilerleyebilir ve düzenli takip yapılmazsa durum kötüleşebilir, potansiyel olarak geri dönüşü olmayan böbrek yetmezliğine ve diyaliz veya organ nakli ihtiyacına yol açabilir.",What are the potential consequences of neglecting kidney function tests for individuals with diabetes?
HF_Diabetes_TR_Translated,Diyabetle yaşayan kişiler için böbrek sorunlarının erken teşhisi neden özellikle önemlidir?,"Diyabetli bireylerde böbrek sorunlarının erken tespiti, zamanında müdahale edilebilmesi açısından çok önemlidir. Sağlık hizmeti sağlayıcıları, böbrek hasarını erken evrelerinde tespit ederek önleyici tedbirler uygulayabilir ve hastalığın ilerlemesini yavaşlatabilir ve potansiyel olarak uzun vadeli komplikasyonları önleyebilir.",Why is early detection of kidney problems particularly important for people living with diabetes?
HF_Diabetes_TR_Translated,Diyabetin genel yönetiminde böbrek fonksiyon testlerinin rolünü açıklayın.,"Böbrek fonksiyon testleri diyabet yönetiminin önemli bir parçasıdır. Diyabetin neden olduğu hasara karşı hassas olan böbreklerin sağlığı hakkında değerli bilgiler sağlarlar. Düzenli izleme, sağlık profesyonellerinin diyabetik böbrek hastalığı riskini değerlendirmesine, gerekirse erken müdahale etmesine ve böbrek fonksiyonlarını korumak için tedavi planlarını ayarlamasına olanak tanır.",Explain the role of kidney function tests in the overall management of diabetes.
HF_Diabetes_TR_Translated,Diyabet hangi spesifik göz rahatsızlığına yol açabilir ve genişlemiş göz muayeneleri diyabetin yönetilmesine nasıl yardımcı olur?,"Diyabet, gözlerdeki kan damarlarına zarar veren ve görme kaybına yol açabilen diyabetik retinopati gelişme riskini artırır. Genişlemiş göz muayeneleri, göz doktorlarının retinayı kapsamlı bir şekilde incelemesine, retinopatinin erken belirtilerini tespit etmesine ve görmeyi korumak için zamanında tedavi sağlamasına olanak tanır.","What specific eye condition can diabetes lead to, and how do dilated eye exams help manage it?"
HF_Diabetes_TR_Translated,Genişlemiş göz muayenesi diyabetli kişilerin görme sağlığı açısından nasıl fayda sağlar?,"Dilate göz muayenesi diyabetli bireyler için çok önemlidir çünkü göz doktorlarının retinayı detaylı bir şekilde incelemesine, diyabetik retinopatinin erken belirtilerini tespit etmesine ve tedaviyi başlatmasına olanak tanır, bu da görme kaybının önlenmesine yardımcı olabilir.",How do dilated eye exams benefit people with diabetes in terms of their vision health?
HF_Diabetes_TR_Translated,"Genişletilmiş göz muayenesi diyabetli bireylerde görme kaybını önlemeye yardımcı olabilir mi? Eğer öyleyse, nasıl?","Evet, genişlemiş göz muayeneleri diyabetli kişilerde görme kaybının önlenmesine yardımcı olabilir. Göz doktorları, diyabetik retinopatinin erken belirtilerini tespit ederek, durumu yönetmek ve ilerlemesini yavaşlatmak veya durdurmak için zamanında tedavi sağlayabilir ve görmeyi koruyabilir.","Can dilated eye exams help prevent vision loss in individuals with diabetes? If so, how?"
HF_Diabetes_TR_Translated,Diyabetli bireylerin düzenli göz muayenesi yaptırması neden önemlidir?,"Diyabetli bireyler için düzenli dilate göz muayeneleri çok önemlidir çünkü bu muayeneler, göz doktorlarının, görme kaybına yol açabilen bir durum olan diyabetik retinopati belirtileri açısından retinayı kapsamlı bir şekilde incelemesine olanak tanır. Erken teşhis ve tedavi görmenin korunmasına yardımcı olabilir.",Why is it important for individuals with diabetes to have regular dilated eye exams?
HF_Diabetes_TR_Translated,Günlük Diyabet Kayıt Sayfası bireylerin hangi bilgileri takip etmesine yardımcı olabilir?,"Cevap: Günlük Diyabet Kayıt Sayfası, bireylerin kan şekeri düzeylerini, ilaç kullanımını, yemek zamanlarını ve diyabet yönetimiyle ilgili diğer bilgileri takip etmelerine olanak tanır.",What information can a Daily Diabetes Record Page help individuals track?
HF_Diabetes_TR_Translated,Günlük Diyabet Kayıt Sayfası kişiselleştirilmiş diyabet bakımına nasıl katkıda bulunur?,"Cevap: Bireyler, diyabet yönetimine ilişkin kapsamlı bir kayıt sağlayarak bu bilgileri sağlık hizmeti sağlayıcılarıyla paylaşabilir, böylece bireysel ihtiyaçlara göre tedavi planlarını ve ayarlamaları kişiselleştirebilirler.",How does a Daily Diabetes Record Page contribute to personalized diabetes care?
HF_Diabetes_TR_Translated,Diyabetin yönetilmesinde Günlük Diyabet Kayıt Sayfasının temel amacı nedir?,"Cevap: Günlük Diyabet Kayıt Sayfası, bireylerin diyabet yönetimlerini izlemeleri ve belgelemeleri için bir araç görevi görerek sağlık hizmeti sağlayıcıları ile iletişimi kolaylaştırarak tedavi konusunda bilinçli kararlar vermelerini sağlar.",What is the primary purpose of a Daily Diabetes Record Page in managing diabetes?
HF_Diabetes_TR_Translated,Günlük Diyabet Kayıt Sayfası hastalar ve sağlık hizmeti sağlayıcıları arasındaki iletişimi geliştirmeye yardımcı olabilir mi?,"Cevap: Evet, Günlük Diyabet Kayıt Sayfası, diyabet yönetiminin açık ve ayrıntılı bir kaydını sağlayarak hastalar ve sağlık hizmeti sağlayıcıları arasındaki iletişimi geliştirebilir, böylece daha bilgili ve etkili bakıma olanak sağlayabilir.",Can a Daily Diabetes Record Page help improve communication between patients and healthcare providers?
HF_Diabetes_TR_Translated,Bireylerin diyabetlerini yönetmelerine yardımcı olabilecek bazı dijital araçlar nelerdir?,"Cevap: Bireylerin kan şekeri düzeylerini takip etmelerine, diyetlerini takip etmelerine ve ilaç tedavisi için hatırlatıcılar ayarlamalarına yardımcı olabilecek, çevrimiçi olarak mevcut birçok diyabet yönetimi uygulaması bulunmaktadır. Bu uygulamalar diyabetin etkili bir şekilde yönetilmesinde değerli destek sağlayabilir.",What are some digital tools that can assist individuals in managing their diabetes?
HF_Diabetes_TR_Translated,Kitapçıktaki bilgilerin yanı sıra bireyler diyabet hastası olan kişilerle nasıl bağlantı kurabilir?,"Yanıt: Özellikle diyabetli bireylere yönelik çevrimiçi topluluklar, deneyimlerin paylaşılması, tavsiye alınması ve bu durumu yönetmenin zorluklarını anlayan kişilerden destek alınması için bir platform sağlayabilir.","Besides the information in the booklet, how can individuals connect with others who also have diabetes?"
HF_Diabetes_TR_Translated,Diyabet yönetimi için eğitim kaynakları sunan saygın kuruluşları önerebilir misiniz?,"Cevap: Amerikan Diyabet Derneği (ADA) ve Ulusal Diyabet ve Sindirim ve Böbrek Hastalıkları Enstitüsü (NIDDK), diyabet yönetimi konusunda kapsamlı bilgi ve eğitim materyalleri sağlayan tanınmış kuruluşlardır.",Can you recommend reputable organizations that offer educational resources for diabetes management?
HF_Diabetes_TR_Translated,Bireylerin diyabet kitapçıklarındaki bilgileri çevrimiçi kaynaklarla desteklemelerinin bazı yolları nelerdir?,"Yanıt: Saygın kuruluşların eğitici web siteleri, çevrimiçi destek grupları ve diyabet yönetimi uygulamaları, diyabetlerini yöneten bireyler için değerli tamamlayıcı bilgiler ve araçlar sağlayabilir.",What are some ways individuals can supplement the information in their diabetes booklet with online resources?
HF_Diabetes_TR_Translated,Diyabetli bireylerin sağlıklarını aktif bir şekilde yönetebilmeleri ve olumlu sonuçlar elde etmek için çalışabilmelerinin bazı temel yolları nelerdir?,"Diyabetli bireyler, durumları hakkında bilgi sahibi olarak, sağlık hizmeti sağlayıcılarının önerilerini takip ederek, düzenli kan şekeri takibi ve sağlıklı yaşam tarzı seçimleri gibi öz yönetim uygulamalarına katılarak, sorular sorarak, endişelerini dile getirerek ve ihtiyaçlarını savunarak sağlık hizmetlerine aktif olarak katılabilir. Bu işbirlikçi yaklaşım, onlara sağlıklarının sorumluluğunu üstlenme ve optimal diyabet yönetimi için çalışma gücü verir.",What are some key ways individuals with diabetes can actively manage their health and work towards positive outcomes?
HF_Diabetes_TR_Translated,Diyabetli bireyler sağlıklarının kontrolünü ele alma ve daha iyi diyabet yönetimi sağlama konusunda kendilerini nasıl güçlendirebilirler?,"Diyabetli bireyler sağlık hizmetlerine aktif olarak katılarak kendilerini güçlendirebilirler. Bu, onların durumları hakkında bilgi sahibi olmayı, sağlık hizmeti sağlayıcılarının tavsiyelerini takip etmeyi, öz yönetim uygulamalarına katılmayı, sorular sormayı, endişeleri ifade etmeyi ve ihtiyaçlarını savunmayı içerir. Bu işbirlikçi yaklaşım, sağlıklarının sorumluluğunu üstlenmelerine ve optimal diyabet yönetimi için çalışmalarına olanak tanır.",How can individuals with diabetes empower themselves to take control of their health and achieve better diabetes management?
HF_Diabetes_TR_Translated,Diyabetli bireylerin sağlık yolculuğuna aktif olarak dahil olmalarını sağlamak için hangi spesifik eylemleri gerçekleştirebilirler?,"Diyabetli bireyler, durumları hakkında bilgi sahibi olarak, sağlık hizmeti sağlayıcılarının tavsiyelerine uyarak, öz yönetim uygulamalarına katılarak, sorular sorarak, endişelerini dile getirerek ve ihtiyaçlarını savunarak aktif olarak katılabilirler. Bu işbirlikçi yaklaşım, onlara sağlıklarının sorumluluğunu üstlenme ve optimal diyabet yönetimi için çalışma gücü verir.",What specific actions can individuals with diabetes take to ensure they are actively involved in their healthcare journey?
HF_Diabetes_TR_Translated,"Sağlık hizmeti sağlayıcılarının tavsiyelerine uymanın yanı sıra, diyabetli bireyler sağlıklarına aktif olarak başka nasıl katkıda bulunabilir?","Diyabetli bireyler, durumları hakkında bilgi sahibi olarak, öz yönetim uygulamalarına katılarak, sorular sorarak, endişelerini ifade ederek ve ihtiyaçlarını savunarak aktif olarak katılabilir. Bu işbirlikçi yaklaşım, onlara sağlıklarının sorumluluğunu üstlenme ve optimal diyabet yönetimi için çalışma gücü verir.","Besides following their healthcare provider's recommendations, how else can individuals with diabetes actively contribute to their well-being?"
HF_Diabetes_TR_Translated,Diabetes Mellitus'un Moleküler ve Klinik Profili ve Komplikasyonları çalışmasının temel hedefleri nelerdir?,"Cevap: Bu çalışma diyabetin moleküler ve klinik yönlerini ve bununla ilişkili komplikasyonları kapsamlı bir şekilde anlamayı amaçlamaktadır.  Nihai amaç bu hastalığın teşhisini, tedavisini ve önlenmesini geliştirmektir.",What are the key objectives of the Molecular and Clinical Profile of Diabetes Mellitus and Its Complications study?
HF_Diabetes_TR_Translated,Diabetes Mellitus'un Moleküler ve Klinik Profili ve Komplikasyonları çalışması daha iyi diyabet yönetimine nasıl katkıda bulunur?,"Cevap: Çalışma, diyabetin moleküler ve klinik özelliklerini ve komplikasyonlarını ortaya çıkararak hastalığın teşhisi, tedavisi ve önlenmesi için daha etkili stratejiler geliştirmeyi amaçlamaktadır. Bu sonuçta hasta bakımının ve sonuçlarının iyileştirilmesine yol açar.",How does the Molecular and Clinical Profile of Diabetes Mellitus and Its Complications study contribute to better diabetes management?
HF_Diabetes_TR_Translated,Diabetes Mellitus'un Moleküler ve Klinik Profili ve Komplikasyonları çalışmasının spesifik odak alanlarını detaylandırabilir misiniz?,"Cevap: Çalışma diyabetin moleküler ve klinik özelliklerinin ve komplikasyonlarının anlaşılmasına odaklanmaktadır. Bu, altta yatan biyolojik süreçlerin araştırılmasını, temel biyobelirteçlerin belirlenmesini ve bu faktörler ile hastalığın ilerlemesi arasındaki ilişkinin araştırılmasını içerir.",Can you elaborate on the specific areas of focus within the Molecular and Clinical Profile of Diabetes Mellitus and Its Complications study?
HF_Diabetes_TR_Translated,Diabetes Mellitus'un Moleküler ve Klinik Profili ve Komplikasyonları çalışmasının diyabet bakımının geleceği üzerindeki beklenen etkisi nedir?,"Cevap: Çalışmanın, hastalığın moleküler ve klinik yönlerine ilişkin değerli bilgiler sağlayarak diyabet bakımını önemli ölçüde etkilemesi bekleniyor. Bu bilgi, gelişmiş teşhis araçlarına, daha hedefe yönelik tedavilere ve etkili önleme stratejilerine yol açacak ve sonuçta diyabetle yaşayan bireylerin yaşamlarını iyileştirecektir.",What is the expected impact of the Molecular and Clinical Profile of Diabetes Mellitus and Its Complications study on the future of diabetes care?
HF_Diabetes_TR_Translated,Diyabet Önleme Programında (DPP) tip 2 diyabetin önlenmesinde yaşam tarzı değişiklikleri ne kadar etkili oldu?,"DPP, yaşam tarzı değişikliklerinin, özellikle de diyet ve fiziksel aktivite yoluyla elde edilen %5-7'lik ılımlı kilo kaybının, özellikle yüksek riskli olarak tanımlanan bireylerde tip 2 diyabet gelişme riskini önemli ölçüde azalttığını gösterdi.",How effective were lifestyle changes in preventing type 2 diabetes in the Diabetes Prevention Program (DPP)?
HF_Diabetes_TR_Translated,DPP'de ne tür bir kilo kaybı tip 2 diyabet riskinin azalmasıyla ilişkilendirildi?,"DPP, diyet ve egzersiz gibi yaşam tarzı değişiklikleri yoluyla %5-7'lik ılımlı bir kilo kaybının, tip 2 diyabet gelişme riskini azaltmada çok önemli olduğunu buldu.",What kind of weight loss was associated with a reduced risk of type 2 diabetes in the DPP?
HF_Diabetes_TR_Translated,DPP'deki yaşam tarzı müdahalelerinden özellikle en çok kim yararlandı?,"DPP, tip 2 diyabet geliştirme riski yüksek olarak tanımlanan bireylerin, yaşam tarzı değişiklikleri, özellikle de ılımlı kilo kaybı yoluyla risklerinde en büyük azalmayı yaşadıklarını gösterdi.",Who specifically benefited the most from the lifestyle interventions in the DPP?
HF_Diabetes_TR_Translated,DPP'nin tip 2 diyabetin önlenmesinde etkili olduğu tespit edilen temel yaşam tarzı değişiklikleri nelerdir?,"DPP, özellikle ılımlı kilo kaybı sağlamak için bir araya getirildiğinde tip 2 diyabet riskinde önemli bir azalmaya katkıda bulunan temel yaşam tarzı değişiklikleri olarak diyet ve fiziksel aktivitenin önemini vurguladı.",What are the key lifestyle changes that the DPP found to be effective in preventing type 2 diabetes?
HF_Diabetes_TR_Translated,"Diyabet Önleme Programı Sonuçları Çalışması (DPPOS), tip 2 diyabetin önlenmesinde yaşam tarzı müdahalelerinin uzun vadeli etkinliğini nasıl doğruladı?","Diyabet Önleme Programının (DPP) takip çalışması olan DPPOS, tip 2 diyabetin önlenmesinde yaşam tarzı müdahalelerinin faydalarının zaman içinde devam ettiğini doğruladı. Çalışma, ilk programdan on yıl sonra bile diyabet riskinde azalmanın devam ettiğini gösterdi.",How did the Diabetes Prevention Program Outcomes Study (DPPOS) validate the long-term effectiveness of lifestyle interventions in preventing type 2 diabetes?
HF_Diabetes_TR_Translated,DPPOS'taki takip süresinin süresi ne kadardı ve yaşam tarzı müdahalelerinin diyabetin önlenmesi üzerindeki etkisi hakkında neler ortaya çıkardı?,"DPPOS, katılımcıları ilk Diyabet Önleme Programından (DPP) sonra on yıl boyunca takip etti. Bu uzatılmış takip süresi, yaşam tarzı müdahalelerinin tip 2 diyabetin önlenmesindeki olumlu etkilerinin sadece anlık değil aynı zamanda uzun süreli olduğunu ve on yıl boyunca devam eden risk azalmasının gözlemlendiğini ortaya çıkardı.","What was the duration of the follow-up period in the DPPOS, and what did it reveal about the impact of lifestyle interventions on diabetes prevention?"
HF_Diabetes_TR_Translated,"DPPOS bulguları, yaşam tarzı müdahalelerinin tip 2 diyabetin önlenmesinde kalıcı faydalar sağladığı fikrini destekledi mi?","Evet, DPPOS bulguları, yaşam tarzı müdahalelerinin tip 2 diyabetin önlenmesinde kalıcı faydalara sahip olduğu fikrini güçlü bir şekilde desteklemektedir. Çalışma, yaşam tarzı değişiklikleriyle elde edilen risk azalmasının, ilk programdan on yıl sonra bile devam ettiğini gösterdi; bu da diyabetin önlenmesinde uzun vadeli olumlu bir etkiye işaret ediyor.",Did the DPPOS findings support the idea that lifestyle interventions have lasting benefits in preventing type 2 diabetes?
HF_Diabetes_TR_Translated,"DPPOS, tip 2 diyabetin önlenmesinde yaşam tarzı müdahalelerinin uzun vadeli etkinliğine ilişkin kanıtları nasıl sağladı?","DPPOS, yaşam tarzı değişiklikleriyle elde edilen risk azalmasının ilk programdan sonra on yıl boyunca devam ettiğini göstererek yaşam tarzı müdahalelerinin uzun vadeli etkinliğine dair kanıt sağladı. Bu sürekli fayda, diyabetin önlenmesinde yaşam tarzı müdahalelerinin önemini vurgulamaktadır.",In what way did the DPPOS provide evidence for the long-term effectiveness of lifestyle interventions in preventing type 2 diabetes?
HF_Diabetes_TR_Translated,Klinik araştırmalar diyabet araştırmalarının ve tedavisinin ilerlemesine nasıl katkıda bulunuyor?,"Klinik araştırmalar, yeni tedavilerin, önleme yöntemlerinin ve diyabet bakımının diğer yönlerinin etkinliğini ve güvenliğini değerlendirmek için yapılandırılmış bir çerçeve sağlayarak diyabet araştırmalarında çok önemli bir rol oynamaktadır. İnsan katılımcıları dahil ederler ve araştırmacıların hasta sonuçlarında iyileştirmelere yol açabilecek değerli veriler toplamasına olanak tanırlar.",How do clinical trials contribute to the advancement of diabetes research and treatment?
HF_Diabetes_TR_Translated,Diyabetle yaşayan insanların yaşamlarını iyileştirmede klinik araştırmaların önemi nedir?,"Klinik araştırmalar, tedavilerin, önleme stratejilerinin ve genel yönetim yaklaşımlarının geliştirilmesine ve iyileştirilmesine yardımcı olarak diyabetli kişilerin yaşamlarını iyileştirmek için gereklidir. Titiz testler ve veri analizi yoluyla bu denemeler, daha etkili ve güvenli tedavilerin geliştirilmesine katkıda bulunarak sonuçta hastalar için daha iyi sağlık sonuçlarına yol açar.",What is the significance of clinical trials in improving the lives of people living with diabetes?
HF_Diabetes_TR_Translated,Klinik araştırmaların diyabetle ilgili tıbbi bilginin genişletilmesine nasıl katkıda bulunduğunu açıklayabilir misiniz?,"Klinik araştırmalar, yeni tedavileri, önleme stratejilerini ve diyabet bakımının diğer yönlerini sistematik olarak araştırarak diyabet hakkındaki tıbbi bilginin genişletilmesine katkıda bulunur. Araştırmacılar, katılımcıları kaydederek ve müdahalelere verdikleri yanıtlar hakkında veri toplayarak, farklı yaklaşımların etkinliği, güvenliği ve optimum kullanımına ilişkin içgörüler kazanabilir ve bu da hastalığın ve yönetiminin daha derinlemesine anlaşılmasına yol açabilir.",Can you explain the process by which clinical trials contribute to expanding medical knowledge about diabetes?
HF_Diabetes_TR_Translated,Diyabet araştırmalarında klinik araştırmaların yürütülmesinin temel amacı nedir?,"Diyabet araştırmalarında klinik araştırmalar yürütmenin temel amacı, yeni tedavilerin, önleme stratejilerinin ve diğer müdahalelerin güvenliğini ve etkinliğini belirlemektir. Araştırmacılar, bu müdahalelerin katılımcılar üzerindeki etkisini değerlendirerek, diyabetli kişiler için daha iyi tedavilerin ve yönetim uygulamalarının geliştirilmesine bilgi sağlayacak değerli bilgiler kazanabilirler.",What is the primary objective of conducting clinical trials in diabetes research?
HF_Diabetes_TR_Translated,Diyabetle ilgili klinik araştırmalar ve potansiyel katılım hakkında bilgi edinmek isteyen kişiler için bazı güvenilir çevrimiçi kaynaklar nelerdir?,"Yanıt: NIH Clinical Research Trials ve You web sitesi (www.nih.gov/health/clinicaltrials) ve devam eden çalışmaların yer aldığı bir veri tabanı olan www.ClinicalTrials.gov, diyabet klinik araştırmaları hakkında mükemmel bilgi kaynaklarıdır.",What are some reliable online resources for individuals interested in learning about diabetes-related clinical trials and potential participation?
HF_Diabetes_TR_Translated,Bireylerin diyabetle ilgili klinik araştırmalara katılma konusunda bilgi bulabilecekleri spesifik web siteleri sağlayabilir misiniz?,"Cevap: Evet, NIH Klinik Araştırma Denemeleri ve Siz web sitesi (www.nih.gov/health/clinicaltrials) ve www.ClinicalTrials.gov, diyabet klinik araştırmaları ve katılımı hakkında kapsamlı bilgi sağlayan özel web siteleridir.",Can you provide specific websites where individuals can find information about participating in clinical trials for diabetes?
HF_Diabetes_TR_Translated,"Birisi bir diyabet klinik araştırmasına katılmak isterse, devam eden çalışmaların listesini nerede bulabilir?","Cevap: www.ClinicalTrials.gov web sitesi, diyabetle ilgili olanlar da dahil olmak üzere devam eden klinik araştırmalar için bir veri tabanı görevi görmektedir. İlgili çalışmaları bulmak için değerli bir kaynaktır.","If someone is interested in participating in a diabetes clinical trial, where can they find a list of ongoing studies?"
