source,question_tr,answer_tr,question_en
HF_Diabetes_TR_Translated,"Diyabetli bireylerin hasta olduklarında tüketebilecekleri kalorisiz, kafeinsiz sıvı örnekleri nelerdir?","Kalorisiz, kafeinsiz sıvıların örnekleri arasında su, şekersiz çay ve berrak et suyu bulunur.","What are some examples of calorie-free, caffeine-free liquids that individuals with diabetes can consume when sick?"
HF_Diabetes_TR_Translated,Diyabetli bireylerin hasta olduklarında bol miktarda sıvı içmeleri neden önemlidir?,"Susuz kalmamak, özellikle hastayken kan şekeri düzeylerini düzenlemek ve dehidrasyonu önlemek için çok önemlidir.  Yüksek kan şekeri idrara çıkmayı artırarak sıvı kaybına neden olabilir.",Why is it important for individuals with diabetes to drink plenty of fluids when they are sick?
HF_Diabetes_TR_Translated,Hasta olan diyabetli bireylere ne tür jelatin önerilir?,"Şekersiz seçenekler düşük kan şekerinin önlenmesi için gerekli karbonhidratları sağlayamayabileceğinden, diyabetli bireyler hasta olduklarında şekersiz olmayan jelatini tercih etmelidir.",What type of gelatin is recommended for individuals with diabetes who are sick?
HF_Diabetes_TR_Translated,Diyabetli birey hastalandığında hangi durumlarda hemen doktoruna başvurmalıdır?,"Diyabetli bireyler, ilaca rağmen kan şekerinin sürekli yüksek çıkması, idrarında veya kanında keton bulunması, tekrarlayan kusma, uzun süren ishal, nefes almada zorluk, yüksek ateş veya bilişsel bozukluk gibi durumlarda derhal doktorlarına başvurmalıdır.",In what situations should an individual with diabetes contact their doctor immediately when sick?
HF_Diabetes_TR_Translated,Diyabetli bireylerin tıbbi kimlik etiketi veya kartı takması neden önemlidir?,"Tıbbi kimlik takmak, acil durumlarda diğerlerini diyabetiniz konusunda uyarır ve özellikle etkili bir şekilde iletişim kuramıyorsanız, onların uygun yardımı sağlamalarına olanak tanır.",Why is it important for individuals with diabetes to wear a medical identification tag or card?
HF_Diabetes_TR_Translated,Zaman dilimleri arasında seyahat ederken diyabeti yönetmek için bazı ipuçları nelerdir?,"Zaman dilimleri arasında seyahat ederken, özellikle insülin için ilaç programlarını ayarlama konusunda tavsiye almak üzere sağlık ekibinize danışın.  Gerekli tüm diyabet malzemelerini el bagajınıza koyun ve yemek zamanlamasına ve kan şekeri takibine dikkat edin.",What are some tips for managing diabetes while traveling across time zones?
HF_Diabetes_TR_Translated,Seyahat ederken neden iki kat fazla diyabet malzemesi taşınması öneriliyor?,"Ekstra malzeme getirmek, beklenmeyen gecikmeler veya varış noktanızda malzeme temininde zorluk yaşanması durumunda yeterli ilaç ve test ekipmanına sahip olmanızı sağlar.",Why is it recommended to carry twice the amount of diabetes supplies when traveling?
HF_Diabetes_TR_Translated,Röntgen makineleri ve insülin pompalarıyla ilişkili potansiyel risk nedir?,"X-ışını makineleri insülin pompalarına zarar verebilir, bu nedenle cihazınızı korumak için havaalanı güvenlik personelinden manuel kontrol talep etmeniz önemlidir.",What is the potential risk associated with X-ray machines and insulin pumps?
HF_Diabetes_TR_Translated,Özellikle diyabet yönetimi için bir afet kitine sahip olmak neden önemlidir?,"Diyabete özel afet kiti, doğal afetler veya elektrik kesintileri gibi düzenli sağlık hizmetlerine veya malzemelere erişimin kesintiye uğrayabileceği acil durumlarda durumunuzu yönetmek için gerekli malzemelere sahip olmanızı sağlar.",Why is it important to have a disaster kit specifically for diabetes management?
HF_Diabetes_TR_Translated,Diyabet felaket çantasına dahil edilmesi gereken bazı temel öğeler nelerdir?,"Bir diyabet felaket kiti, kan şekeri ölçüm cihazı, lansetler, test şeritleri, diyabet ilaçları, insülin (varsa), glukagon kiti, glikoz tabletleri veya diğer hızlı etkili karbonhidratlar, antibiyotik kremi, tıbbi bilgilerinizin bir kopyası ve acil durum iletişim numaralarını içermelidir.",What are some essential items to include in a diabetes disaster kit?
HF_Diabetes_TR_Translated,Diyabetli kadınların hamile kalmadan önce optimal kan şekeri kontrolünü sağlaması neden önemlidir?,Hamilelik sırasında yüksek kan şekeri seviyeleri hem anne hem de gelişmekte olan bebek için risk oluşturabilir. Gebelik öncesinde iyi kontrolün sağlanması bu risklerin en aza indirilmesine yardımcı olur.,Why is it important for women with diabetes to achieve optimal blood glucose control before becoming pregnant?
HF_Diabetes_TR_Translated,Hamilelik planlayan diyabetli kadınlara bazı yaşam tarzı önerileri nelerdir?,"Diyabetli kadınlar hamilelik planlarken sigara ve alkolden uzak durmalı, sağlıklı bir beslenme planı izlemeli ve düzenli fiziksel aktiviteye devam etmelidir.",What are some lifestyle recommendations for women with diabetes who are planning a pregnancy?
HF_Diabetes_TR_Translated,Diyabetli kadınlara hamilelik öncesi ne tür tıbbi değerlendirmeler önerilir?,"Diyabetli kadınların hamilelikten önce gözlerini, kalp ve kan damarlarını, tansiyonlarını ve böbreklerini kontrol ettirmeleri gerekmektedir.  Bir doktor ayrıca herhangi bir sinir hasarını da değerlendirmelidir.",What types of medical evaluations are recommended for women with diabetes before pregnancy?
HF_Diabetes_TR_Translated,"""Her Ziyarette Sağlık Ekibinizle Görüşülmesi Gerekenler"" tablosunu kullanmanın potansiyel faydaları nelerdir?","Bu tablo, diyabet yönetiminizin temel yönlerini sağlık hizmeti sağlayıcılarınızla tartışmak, kapsamlı bakım sağlamak ve olası endişelerinizi veya sorularınızı ele almak için yararlı bir hatırlatma görevi görür.","What are the potential benefits of using the ""Things to Discuss with Your Health Care Team at Each Visit"" chart?"
HF_Diabetes_TR_Translated,Çoğu diyabetli birey için hedef kan basıncı nedir?,"Diyabetli çoğu kişi için hedef kan basıncı, doktorları tarafından aksi belirtilmediği sürece 140/80 mmHg'nin altındadır.",What is the target blood pressure for most individuals with diabetes?
HF_Diabetes_TR_Translated,Diyabetli bireylerin karşılaştığı yaygın ayak sorunları nelerdir ve bunları derhal bildirmek neden önemlidir?,"Diyabetli bireyler ayaklarında uyuşukluk, karıncalanma veya yavaş iyileşen yaralar yaşayabilir. Bu sorunların bir sağlık uzmanına bildirilmesi, erken müdahale ve ayak ülseri veya amputasyon gibi komplikasyonların önlenmesi açısından çok önemlidir.","What are some common foot problems experienced by individuals with diabetes, and why is it crucial to report them promptly?"
HF_Diabetes_TR_Translated,Diyabetli bireyler stres ve duygusal zorluklarla nasıl başa çıkabilir?,"Bireyler rahatlama teknikleri, farkındalık uygulamaları, düzenli egzersiz, hobilerle meşgul olma ve sevdiklerinden veya ruh sağlığı uzmanlarından destek alma yoluyla stresi yönetebilirler.",How can individuals with diabetes cope with stress and emotional challenges?
HF_Diabetes_TR_Translated,Diyabetli bireylere sigarayı bırakmanın faydaları nelerdir?,"Sigarayı bırakmak genel sağlığı önemli ölçüde iyileştirir ve kalp hastalığı, felç, sinir hasarı ve diğer sağlık sorunları gibi diyabetle ilişkili komplikasyon riskini azaltır.",What are the benefits of quitting smoking for individuals with diabetes?
HF_Diabetes_TR_Translated,"""Yılda En Az Bir veya İki Kez Yapılması Gereken Test, Muayene ve Aşılar"" tablosunun amacı nedir?","Bu tablo, diyabetli bireylerin önerilen testleri, muayeneleri ve aşıları takip etmeleri, proaktif sağlık hizmetlerini teşvik etmeleri ve potansiyel sorunların erken tespit edilmesi için uygun bir kontrol listesi sağlar.","What is the purpose of the ""Tests, Exams, and Vaccines to Get at Least Once or Twice a Year"" chart?"
HF_Diabetes_TR_Translated,Kan lipitleri nedir ve diyabetli bireylerde neden izlenir?,"Kan lipitleri, kanda dolaşan yağlar olan kolesterol ve trigliseritleri kapsar. Diyabetli bireyler, kardiyovasküler hastalığa katkıda bulunabilecek dislipidemi (anormal kan lipit seviyeleri) riski altındadır.  Kan lipitlerinin izlenmesi bu risklerin yönetilmesine ve kalp sağlığının korunmasına yardımcı olur.","What are blood lipids, and why are they monitored in individuals with diabetes?"
HF_Diabetes_TR_Translated,Böbrek fonksiyon testleri nedir ve diyabetli bireyler için neden önemlidir?,"Böbrek fonksiyon testleri, böbreklerin kandaki atık ürünleri filtrelemedeki etkinliğini değerlendirir. Diyabet böbreklere giderek zarar verebilir ve potansiyel olarak diyabetik böbrek hastalığına yol açabilir. Böbrek fonksiyonunun düzenli olarak izlenmesi, potansiyel böbrek sorunlarının erken tespit edilmesini ve yönetilmesini sağlar.","What are kidney function tests, and why are they important for individuals with diabetes?"
HF_Diabetes_TR_Translated,Diyabetli bireylerde dilate göz muayenesi neden gereklidir?,"Diyabet, gözlerdeki kan damarlarına zarar verebilecek ve potansiyel olarak görme kaybına yol açabilecek bir durum olan diyabetik retinopati riskini artırır. Genişlemiş göz muayeneleri, göz doktorlarının retinayı kapsamlı bir şekilde incelemesine, retinopatinin erken belirtilerini tespit etmesine ve görmeyi korumak için zamanında tedavi sağlamasına olanak tanır.",Why are dilated eye exams essential for individuals with diabetes?
HF_Diabetes_TR_Translated,Günlük Diyabet Kayıt Sayfası diyabet yönetimi için nasıl etkili bir şekilde kullanılabilir?,"Günlük Diyabet Kayıt Sayfası, bireylerin kan şekeri düzeylerini, ilaç kullanımını, yemek zamanlarını ve diğer ilgili bilgileri takip etmelerine yardımcı olur. Bu kayıt, sağlık hizmeti sağlayıcılarıyla paylaşıldığında kişiselleştirilmiş bakımı ve tedavi planlarında ayarlamaları kolaylaştırır.",How can the Daily Diabetes Record Page be used effectively for diabetes management?
HF_Diabetes_TR_Translated,Bireylerin diyabetlerini yönetmelerini desteklemek için mevcut bazı ek kaynaklar veya araçlar nelerdir?,"Kitapçıkta verilen bilgilerin ötesinde, bireyler diyabet yönetimi uygulamaları, çevrimiçi topluluklar ve Amerikan Diyabet Derneği ve NIDDK gibi saygın kuruluşların eğitim web siteleri gibi değerli çevrimiçi kaynaklara erişebilirler.",What are some additional resources or tools available to support individuals in managing their diabetes?
HF_Diabetes_TR_Translated,Diyabetli bireyler olumlu sonuçlar elde etmek için sağlık hizmetlerine aktif olarak nasıl katılabilir?,"Bireyler, durumları hakkında bilgi sahibi olarak, sağlık hizmeti sağlayıcılarının tavsiyelerine uyarak, öz yönetim uygulamalarına katılarak, sorular sorarak, endişelerini dile getirerek ve ihtiyaçlarını savunarak aktif bir rol oynayabilirler. Bu işbirlikçi yaklaşım, bireylere sağlıklarının sorumluluğunu üstlenme ve optimal diyabet yönetimi için çalışma gücü verir.",How can individuals with diabetes actively participate in their healthcare to achieve positive outcomes?
HF_Diabetes_TR_Translated,Diabetes Mellitus ve Komplikasyonlarının Moleküler ve Klinik Profili çalışmasının amacı nedir?,"Bu araştırma çabası, diyabetin ve komplikasyonlarının moleküler ve klinik özelliklerini ortaya çıkarmayı ve sonuçta gelişmiş tanı, tedavi ve önleme stratejilerine yol açmayı amaçlamaktadır.",What is the goal of the Molecular and Clinical Profile of Diabetes Mellitus and Its Complications study?
HF_Diabetes_TR_Translated,Diyabet Önleme Programının (DPP) temel bulguları nelerdi?,"DPP, diyet ve fiziksel aktivite gibi yaşam tarzı değişiklikleriyle elde edilen ılımlı kilo kaybının (%5-7), özellikle yüksek riskli bireylerde tip 2 diyabet gelişme riskini önemli ölçüde azaltabileceğini gösterdi.",What were the key findings of the Diabetes Prevention Program (DPP)?
HF_Diabetes_TR_Translated,"Diyabet Önleme Programı Sonuçları Çalışması (DPPOS), yaşam tarzı müdahalelerinin uzun vadeli faydaları hakkında neyi ortaya çıkardı?","DPP'nin devamı olan DPPOS, tip 2 diyabetin önlenmesinde yaşam tarzı müdahalelerinin sürdürülebilir faydalarını doğruladı ve ilk programdan 10 yıl sonra bile risk azalmasının devam ettiğini gösterdi.",What did the Diabetes Prevention Program Outcomes Study (DPPOS) reveal about the long-term benefits of lifestyle interventions?
HF_Diabetes_TR_Translated,Diyabet araştırmalarını ve tedavisini ilerletmek için klinik araştırmalar neden önemlidir?,"Klinik araştırmalar, yeni tedavilerin, önleme stratejilerinin ve diyabet bakımının diğer yönlerinin güvenliğini ve etkinliğini değerlendiren, insan katılımcıların yer aldığı araştırma çalışmalarıdır. Bu denemeler tıbbi bilginin genişletilmesi ve hasta sonuçlarının iyileştirilmesi için gereklidir.",Why are clinical trials important for advancing diabetes research and treatment?
HF_Diabetes_TR_Translated,Bireyler diyabetle ilgili klinik araştırmalara katılma konusunda nasıl bilgi bulabilir?,Klinik araştırmalar ve katılımla ilgili bilgilere NIH Clinical Research Trials and You web sitesinden (www.nih.gov/health/clinicaltrials) ve devam eden çalışmaların yer aldığı bir veri tabanı olan www.ClinicalTrials.gov'dan ulaşılabilir.,How can individuals find information about participating in clinical trials related to diabetes?
HF_Diabetes_TR_Translated,Diyabet dostu beslenmede sağlıklı yağların rolü nedir?,"Tekli doymamış ve çoklu doymamış yağlar gibi sağlıklı yağlar genel sağlık açısından önemlidir ve diyabet dostu bir diyete dahil edilebilir.  Kaynaklar arasında zeytinyağı, avokado, fındık, tohumlar, yağlı balıklar, keten tohumu ve ceviz bulunur.",What is the role of healthy fats in a diabetes-friendly diet?
HF_Diabetes_TR_Translated,Diyabetli bireylerde porsiyon kontrolü neden önemlidir?,"Porsiyon kontrolü, kalori alımını düzenlemeye yardımcı olur ve kan şekeri seviyelerindeki keskin yükselişleri önler, bu da kan şekerinin yönetilmesi ve kilo yönetimi hedeflerine ulaşılması açısından hayati önem taşır.",Why is portion control important for individuals with diabetes?
HF_Diabetes_TR_Translated,Diyabetli bireyler için kuvvet antrenmanının faydaları nelerdir?,"Kuvvet antrenmanı insülin duyarlılığını arttırır, kas kütlesini arttırır ve daha iyi kan şekeri kontrolüne ve genel fiziksel fonksiyona katkıda bulunur.",What are the benefits of strength training for individuals with diabetes?
HF_Diabetes_TR_Translated,Diyabetli bireyler fiziksel aktivite sırasında neden karbonhidrat açısından zengin bir atıştırmalık veya içecek taşımalıdır?,"Bir karbonhidrat kaynağı taşımak, özellikle insülin veya bazı diyabet ilaçları kullananlarda, egzersiz sırasında meydana gelebilecek kan şekeri seviyelerindeki potansiyel düşüşleri önlemeye yardımcı olur.",Why should individuals with diabetes carry a carbohydrate-rich snack or drink during physical activity?
HF_Diabetes_TR_Translated,Diyabet ilaçlarını doktora danışmadan bırakmanın olası sonuçları nelerdir?,"Diyabet ilaçlarının aniden kesilmesi, kan şekeri seviyelerinde hızlı bir artışa yol açarak potansiyel olarak hiperglisemiye ve ilgili komplikasyonlara neden olabilir. İlaç rejiminizde herhangi bir değişiklik yapmadan önce mutlaka doktorunuza danışın.",What are the potential consequences of stopping diabetes medications without consulting a doctor?
HF_Diabetes_TR_Translated,İnsülin pompası nasıl çalışır ve faydaları nelerdir?,"İnsülin pompası, gün boyunca sürekli, kişiselleştirilmiş dozda insülin sağlayan, daha hassas kan şekeri kontrolü ve yemek zamanlarında ve aktivitelerde daha fazla esneklik sağlayan küçük, giyilebilir bir cihazdır.","How does an insulin pump work, and what are its benefits?"
HF_Diabetes_TR_Translated,İnsülin enjeksiyon portu nedir ve geleneksel insülin enjeksiyonlarından farkı nedir?,"İnsülin enjeksiyon portu, derinin altına yerleştirilen küçük bir tüp olup, tekrarlanan cilt delikleri olmadan insülin enjeksiyonlarına izin vererek daha fazla konfor ve rahatlık sunar.","What is an insulin injection port, and how does it differ from traditional insulin injections?"
HF_Diabetes_TR_Translated,Aspirinin diyabet tedavisindeki rolü nedir?,"Düşük dozda aspirin, diyabetli bireylere kalp hastalığı riskini azaltmak için sıklıkla tavsiye edilir, çünkü bu kişilerde kardiyovasküler sorun riski yüksektir.",What is the role of aspirin in diabetes management?
HF_Diabetes_TR_Translated,Diyabet ilaçları için haftalık hap kutusu kullanmak neden faydalıdır?,"Bir ilaç kutusu, ilaçların düzenlenmesine yardımcı olur ve bunların doğru zamanlarda alınmasını sağlayarak ilaca uyumu ve diyabet yönetimini iyileştirir.",Why is it beneficial to use a weekly pill box for diabetes medications?
HF_Diabetes_TR_Translated,Diyabetli bireyler için sürekli glikoz takibinin potansiyel faydaları nelerdir?,"Sürekli glikoz izleme, gerçek zamanlı kan şekeri ölçümleri sağlayarak gıda alımında, fiziksel aktivitede veya ilaçlarda proaktif ayarlamalara izin vererek daha sıkı kan şekeri kontrolüne ve hipoglisemi veya hiperglisemi riskinin azalmasına olanak tanır.",What are the potential benefits of continuous glucose monitoring for individuals with diabetes?
HF_Diabetes_TR_Translated,Diyabetli bireyler sağlık bakım ziyaretleri sırasında kendilerini nasıl etkili bir şekilde savunabilirler?,"Bireyler önceden bir soru listesi hazırlayarak, tartışmalara aktif olarak katılarak, endişelerini dile getirerek ve diyabet yönetim planlarının herhangi bir yönü hakkında açıklama arayarak kendilerini savunabilirler.",How can individuals with diabetes effectively advocate for themselves during healthcare visits?
HF_Diabetes_TR_Translated,Bir bireyin A1C hedefini hangi faktörler etkiler?,"A1C hedefleri, diyabetin süresi, diğer sağlık durumlarının varlığı ve bireysel sağlık hedefleri gibi faktörlere göre kişiselleştirilir. Sağlık uzmanınız sizin için uygun bir A1C hedefi belirleyecektir.",What factors influence an individual's A1C target?
HF_Diabetes_TR_Translated,Ketoasidozun erken tespiti ve tedavisi neden önemlidir?,"Ketoasidoz, tedavi edilmezse yaşamı tehdit edebilecek ciddi bir durumdur. Erken teşhis ve tedavi ciddi komplikasyonları önleyebilir ve sonuçları iyileştirebilir. Ketoasidozdan şüpheleniyorsanız derhal tıbbi yardım alın.",Why is early detection and treatment of ketoacidosis crucial?
HF_Diabetes_TR_Translated,Kitapçığa telaffuz kılavuzu eklemenin amacı nedir?,"Telaffuz kılavuzu, okuyucuların diyabetle ilgili tıbbi terimleri doğru telaffuz etmelerine, anlayışlarını ve sağlık hizmeti sağlayıcılarıyla iletişimlerini geliştirmelerine yardımcı olur.",What is the purpose of including a pronunciation guide in the booklet?
HF_Diabetes_TR_Translated,Diyabetli bireyler kendi bölgelerinde kayıtlı bir diyetisyeni nasıl bulabilirler?,"Beslenme ve Diyetetik Akademisi'nin web sitesi (www.eatright.org), yakınınızdaki kayıtlı diyetisyenleri bulmanız için bir rehber sağlar.",How can individuals with diabetes locate a registered dietitian in their area?
HF_Diabetes_TR_Translated,"Bireyler, yakınlarında sertifikalı bir diyabet eğitimcisi bulmak için hangi kuruluşla iletişime geçebilir?","Amerikan Diyabet Eğitimcileri Birliği (www.diabeteseducator.org), bireylerin kendi bölgelerinde sertifikalı diyabet eğitimcileri bulmalarına yardımcı olabilir.",What organization can individuals contact to find a certified diabetes educator near them?
HF_Diabetes_TR_Translated,Amerikan Diyabet Derneği'nin diyabetli bireyleri desteklemedeki rolü nedir?,"Amerikan Diyabet Derneği, diyabetli bireylere bilgi, eğitim ve topluluk bağlantıları sağlayarak kaynaklar, destek ve savunuculuk sunmaktadır.",What is the role of the American Diabetes Association in supporting individuals with diabetes?
HF_Diabetes_TR_Translated,Juvenil Diyabet Araştırma Vakfı'nın (JDRF) misyonu nedir?,"JDRF, tip 1 diyabete yönelik araştırmaları finanse etmeye kendini adamıştır ve bu durumla yaşayan bireylerin tedavilerini bulmayı ve yaşamlarını iyileştirmeyi amaçlamaktadır.",What is the mission of the Juvenile Diabetes Research Foundation (JDRF)?
HF_Diabetes_TR_Translated,Ulusal Diyabet Eğitim Programının (NDEP) federal olarak finanse edilmesinin önemi nedir?,"NDEP'e yönelik federal finansman, diyabet eğitimi ve önlenmesinin ulusal öneminin altını çizerek, diyabetli bireylere ve risk altındaki kişilere yaygın erişim ve destek sağlıyor.",What is the significance of the National Diabetes Education Program (NDEP) being federally funded?
HF_Diabetes_TR_Translated,Ulusal Diyabet Bilgi Takas Odası'nın (NDIC) temel işlevi nedir?,"NDIC, diyabet bilgileri için merkezi bir kaynak görevi görerek diyabetli bireylere, ailelerine, sağlık profesyonellerine ve genel halka güvenilir ve güncel kaynaklar sağlar.",What is the primary function of the National Diabetes Information Clearinghouse (NDIC)?
HF_Diabetes_TR_Translated,"""Diyabet Rehberiniz"" kitapçığının halkın erişimine hazır olması neden önemlidir?","Kitapçığın erişilebilirliği, bireylere diyabet yönetiminde aktif rol alma gücü vererek, onlara sağlıkları hakkında bilinçli kararlar vermeleri için gerekli bilgi ve araçları sağlar.","Why is it important for the ""Your Guide to Diabetes"" booklet to be readily available to the public?"
HF_Diabetes_TR_Translated,Kitapçık diyabetle yaşamanın duygusal yönlerini nasıl ele alıyor?,"Kitapçık, diyabetin duygusal etkisini kabul ederek bireyleri her türlü üzüntü, öfke veya stres duygularını sağlık uzmanları veya ruh sağlığı uzmanlarıyla tartışmaya teşvik ediyor.",How does the booklet address the emotional aspects of living with diabetes?
HF_Diabetes_TR_Translated,Diyabet ile vücudun bağışıklık sistemi arasındaki ilişki nedir?,"Diyabet, özellikle de kontrolsüz diyabet, bağışıklık sistemini zayıflatarak bireyleri enfeksiyonlara ve diğer sağlık komplikasyonlarına karşı daha duyarlı hale getirebilir.",What is the relationship between diabetes and the body's immune system?
HF_Diabetes_TR_Translated,Diyabetli bireylerin olası ilaç etkileşimleri konusunda bilgi sahibi olması neden önemlidir?,Bazı ilaçlar kan şekeri düzeylerini etkileyebilir veya diyabet ilaçlarıyla etkileşime girebilir; bu da olumsuz etkileri önlemek için tüm ilaçları sağlık uzmanınızla konuşmanın önemini vurgular.,Why is it important for individuals with diabetes to be aware of potential medication interactions?
HF_Diabetes_TR_Translated,Diyabetli bireylerde ilaca uyumu teşvik etmeye yönelik bazı stratejiler nelerdir?,"İlaç uyumunu artırmaya yönelik stratejiler arasında hap düzenleyicilerin kullanılması, hatırlatıcıların ayarlanması, ilaç rejimlerinin basitleştirilmesi ve ilaca erişim veya ilacın karşılanabilirliği önündeki engellerin ele alınması yer alır.",What are some strategies for promoting medication adherence in individuals with diabetes?
HF_Diabetes_TR_Translated,"Diyabet yönetimi uygulamaları gibi teknolojiler, bireylerin durumlarını yönetmelerine nasıl destek olabilir?","Diyabet yönetimi uygulamaları, kan şekeri düzeylerini takip etmek, ilaç hatırlatmaları, yemek planlaması, aktivite kaydı ve eğitim kaynaklarına erişim için araçlar sunarak bireylerin diyabet bakımında daha proaktif bir rol üstlenmelerini sağlayabilir.","How can technology, such as diabetes management apps, support individuals in managing their condition?"
HF_Diabetes_TR_Translated,Farklı insülin türlerini ve bunların etki şekillerini anlamanın önemi nedir?,"Farklı insülin türlerinin başlangıç ​​süreleri, zirve etkileri ve etki süreleri farklılık gösterir. Bu özellikleri anlamak, kan şekeri kontrolünü optimize etmek ve hipoglisemi veya hiperglisemiyi önlemek için çok önemlidir.",What is the significance of understanding the different types of insulin and their modes of action?
HF_Diabetes_TR_Translated,Diyabetli bireyler sağlık sistemi içerisinde kendi ihtiyaçlarını ve tercihlerini nasıl savunabilirler?,"Bireyler endişelerini ileterek, sorular sorarak, gerekirse ikinci görüş alarak ve sağlık hizmeti sağlayıcılarıyla ortak karar alma sürecine katılarak kendilerini savunabilirler.",How can individuals with diabetes advocate for their needs and preferences within the healthcare system?
HF_Diabetes_TR_Translated,Diyabetli bireylerin kaliteli sağlık hizmetlerine erişimde karşılaşabilecekleri bazı potansiyel zorluklar nelerdir?,"Zorluklar arasında finansal engeller, sigorta kapsamının eksikliği, uzman sağlayıcılara sınırlı erişim, coğrafi kısıtlamalar ve sağlık eşitsizlikleri yer alabilir.",What are some potential challenges individuals with diabetes may face in accessing quality healthcare?
HF_Diabetes_TR_Translated,Toplum kaynakları ve destek grupları diyabetle yaşayan bireylere nasıl fayda sağlayabilir?,"Topluluk kaynakları ve destek grupları aidiyet duygusu, ortak deneyimler, duygusal destek, pratik tavsiyeler ve eğitim ve savunuculuk fırsatları sunar.",How can community resources and support groups benefit individuals living with diabetes?
